,Recipe Name,Prepare Time,Cook Time,Total Time,RecipeID,Servings
2806,Nutty Sweethearts Recipe ,NULL,NULL,NULL,10779,8
2807,Passover (Pesach) Brownies Recipe ,NULL,NULL,NULL,10780,24
2808,'Bird''s Nests II Recipe ',NULL,NULL,NULL,10781,6
2809,'Bird''s Nests III Recipe ',NULL,NULL,NULL,10782,6
2810,Easy Peanut Butter Cookies Recipe ,NULL,NULL,NULL,10783,60
2811,'Robbi''s M&Ms® Cookies Recipe ',NULL,NULL,NULL,10785,72
2812,Rock Cookies Recipe ,NULL,NULL,NULL,10786,24
2813,Caramel Shortbread Recipe ,NULL,NULL,NULL,10788,16
2814,Sugar Cookies X Recipe ,NULL,NULL,NULL,10789,54
2815,Pinwheel Cookies III Recipe ,NULL,NULL,NULL,10792,24
2816,Swedish Spritzs Recipe ,NULL,NULL,NULL,10794,12
2817,Hobo Cookies Recipe ,NULL,NULL,NULL,10795,120
2818,Cashew Nut Cookies Recipe ,NULL,NULL,NULL,10796,18
2819,Chocolate Chip Cookies III Recipe ,NULL,NULL,NULL,10799,48
2820,Melt in your Mouth Cookies II Recipe ,NULL,NULL,NULL,10802,12
2821,Chocolate Peanut Butter Squares Recipe ,NULL,NULL,NULL,10804,18
2822,'Grammie''s Sweet Milk Cookies Recipe ',NULL,NULL,NULL,10806,48
2823,Sour Cream Pockets Recipe ,NULL,NULL,NULL,10807,24
2824,Cereal Treats I Recipe ,NULL,NULL,NULL,10808,12
2825,Conga Squares Recipe ,NULL,NULL,NULL,10810,36
2826,Russian Tea Cakes III Recipe ,NULL,NULL,NULL,10811,24
2827,Pregnant Doll (Easter Baby) Recipe ,45,35,170,10812,6
2828,Best Chocolate Chip Cookies Recipe ,20,10,60,10813,24
2829,Mace Cookies Recipe ,NULL,NULL,NULL,10814,48
2830,Monster Cookies VII Recipe ,NULL,NULL,NULL,10815,80
2831,Bakestones Recipe ,NULL,NULL,NULL,10816,72
2832,'Sophie''s Kolacky Recipe ',45,20,95,10817,18
2833,'Neecie''s PBJ Bars Recipe ',NULL,NULL,NULL,10818,12
2834,Ranger Cookies II Recipe ,NULL,NULL,NULL,10819,18
2835,Candy Bar Brownies Recipe ,NULL,NULL,NULL,10822,6
2836,The Ultimate Chocolate Chip Cookie Recipe ,NULL,NULL,NULL,10823,48
2837,Everything Cookies II Recipe ,NULL,NULL,NULL,10824,36
2838,Kitty Kat Bars Recipe ,NULL,NULL,NULL,10825,12
2839,Lemon Glazed Date Sticks Recipe ,NULL,NULL,NULL,10826,12
2840,Potato Flake Cookies Recipe ,NULL,NULL,NULL,10827,18
2841,Meringue Squares Recipe ,NULL,NULL,NULL,10828,24
2842,Italian Egg Dough Recipe ,NULL,NULL,NULL,10829,12
2843,German Chocolate Brownie Cookies Recipe ,NULL,NULL,NULL,10830,18
2844,Thin Mint Cookies Recipe ,NULL,NULL,NULL,10831,18
2845,Old Time Refrigerator Cookies Recipe ,NULL,NULL,NULL,10832,60
2846,'Birds'' Nests IV Recipe ',NULL,NULL,NULL,10834,18
2847,Chocolate Crackle Cookies Recipe ,NULL,NULL,NULL,10835,18
2848,Old Fashioned Peanut Butter Cookies Recipe ,NULL,NULL,NULL,10836,60
2849,Triple Chocolate Chip Cookies Recipe ,NULL,NULL,NULL,10837,18
2850,Dalmatian Bars Recipe ,NULL,NULL,NULL,10838,12
2851,Candy,NULL,NULL,NULL,10841,48
2852,Vanilla ,NULL,NULL,NULL,10842,48
2853,Peanut Butter Bars II Recipe ,NULL,NULL,NULL,10843,12
2854,Apple Oatmeal Bars Recipe ,NULL,NULL,NULL,10844,12
2855,Molasses Cookies III Recipe ,NULL,NULL,NULL,10845,36
2856,Graham Cracker Cookies Recipe ,NULL,NULL,NULL,10847,18
2857,Gingersnaps II Recipe ,NULL,NULL,NULL,10852,24
2858,Eskimo Cookies Recipe ,NULL,NULL,NULL,10854,18
2859,Cut,NULL,NULL,NULL,10855,72
2860,Melt ,10,15,25,10856,24
2861,Dishpan Cookies I Recipe ,NULL,NULL,NULL,10857,60
2862,Dishpan Chocolate Chip Cookies Recipe ,NULL,NULL,NULL,10858,36
2863,'Shawn''s Study Snacks Recipe ',NULL,NULL,NULL,10860,60
2864,Pohany Recipe ,NULL,NULL,NULL,10861,36
2865,Banana Oat and Bran Cookies Recipe ,5,10,15,10862,24
2866,Chocolate Chip Crispy Cookies Recipe ,NULL,NULL,NULL,10863,18
2867,Bruti Ma Buoni Recipe ,NULL,NULL,NULL,10865,60
2868,Apees Recipe ,NULL,NULL,NULL,10866,7
2869,Prize Winning Oatmeal Drop Cookies Recipe ,15,10,25,10867,30
2870,Old Fashioned Fudge Cookies Recipe ,NULL,NULL,NULL,10868,24
2871,Vanilla Brownies Recipe ,15,45,60,10870,36
2872,Apple Butter Beauties Recipe ,NULL,NULL,NULL,10871,12
2873,Fudge Bars Recipe ,NULL,NULL,NULL,10872,30
2874,Apricot,20,45,65,10873,24
2875,Biscochitos II Recipe ,NULL,NULL,NULL,10875,36
2876,'Grandma Sheets'' Sugar Cookies Recipe ',NULL,NULL,NULL,10876,48
2877,Death By Caramel Cookies Recipe ,NULL,NULL,NULL,10877,10
2878,Beer Nut Cookies Recipe ,NULL,NULL,NULL,10878,27
2879,Cannoli I Recipe ,NULL,NULL,NULL,10879,18
2880,Pecan Tassies Recipe ,NULL,NULL,NULL,10880,12
2881,Rocky Road Recipe ,NULL,NULL,NULL,10881,6
2882,French Crullers Recipe ,NULL,NULL,NULL,10882,18
2883,Oatmeal Raisin Cookies III Recipe ,NULL,NULL,NULL,10883,36
2884,Babe Ruth Bars Recipe ,15,NULL,30,10884,18
2885,Peanut Butter Candy Blossoms Recipe ,30,15,120,10885,20
2886,Black and White Cookies II Recipe ,NULL,NULL,NULL,10886,12
2887,Cherry Flips Recipe ,10,10,30,10887,18
2888,Irish Potatoes Recipe ,NULL,NULL,NULL,10888,24
2889,Wookie Cookies Recipe ,NULL,NULL,NULL,10889,18
2890,'Children''s Delight Cookies Recipe ',NULL,NULL,NULL,10890,30
2891,Peanut Butter Chip Cookies I Recipe ,NULL,NULL,NULL,10891,30
2892,Doubly Delicious Peanut Butter Cookies Recipe ,NULL,NULL,NULL,10892,18
2893,My Favorite Cookie Recipe ,NULL,NULL,NULL,10893,48
2894,Black Pepper Cookies Recipe ,NULL,NULL,NULL,10894,48
2895,Chocolate Butterscotch Squares Recipe ,NULL,NULL,NULL,10895,12
2896,Cloud Nine Butterscotch Squares Recipe ,NULL,NULL,NULL,10896,6
2897,No Bake Peanut Butter Cookies II Recipe ,NULL,NULL,NULL,10898,48
2898,Langues de Chat Recipe ,35,10,70,10899,36
2899,Amish Oatmeal Cookies Recipe ,NULL,NULL,NULL,10900,48
2900,Williamsburg Cookies Recipe ,NULL,NULL,NULL,10901,18
2901,Anise Tuiles Recipe ,NULL,NULL,NULL,10902,12
2902,Cinnamon Sugar Butter Cookies I Recipe ,NULL,NULL,NULL,10903,12
2903,Good Cookies I Recipe ,NULL,NULL,NULL,10908,24
2904,Cocoa Quickies Recipe ,15,NULL,75,10910,18
2905,Double Chocolate Mint Cookies Recipe ,25,8,33,10911,96
2906,Ritz® Cookies Recipe ,NULL,NULL,NULL,10912,36
2907,Frosted Maple Cookies Recipe ,NULL,NULL,NULL,10913,12
2908,Lemon Madeleines Recipe ,NULL,NULL,NULL,10914,12
2909,White Chocolate Pumpkin Cookies Recipe ,NULL,NULL,NULL,10915,18
2910,'Katrina''s Best',NULL,NULL,NULL,10916,16
2911,Gingerbread Folk Recipe ,NULL,NULL,NULL,10919,15
2912,Cinnamon Butter Cookies Recipe ,NULL,NULL,NULL,10920,36
2913,Abernathy Biscuits Recipe ,50,10,60,10922,12
2914,Sour Cream Sugar Cookies III Recipe ,NULL,NULL,NULL,10923,60
2915,Jumbo Banana Cookies Recipe ,NULL,NULL,NULL,10924,18
2916,Peanut Butter Fingers III Recipe ,NULL,NULL,NULL,10925,12
2917,Cake Mix Cookies IV Recipe ,NULL,NULL,NULL,10926,24
2918,Cashew Snaps Recipe ,20,15,35,10928,18
2919,Pudding Cookies I Recipe ,NULL,NULL,NULL,10929,24
2920,Butter Balls II Recipe ,NULL,NULL,NULL,10930,24
2921,Buckeye Cookies III Recipe ,NULL,NULL,NULL,10931,18
2922,'Becky''s Sugary Sugar Cookies Recipe ',NULL,NULL,NULL,10932,24
2923,Super Dooper Peanut Butter Recipe ,NULL,NULL,NULL,10933,48
2924,Italian Cheesecake Cookies Recipe ,NULL,NULL,NULL,10934,12
2925,'Bryan''s Red Ribbon Recipe Recipe ',NULL,NULL,NULL,10935,18
2926,Almond Cookies II Recipe ,NULL,NULL,NULL,10936,36
2927,Pumpkin Cookies IV Recipe ,NULL,NULL,NULL,10937,48
2928,Tea Cakes II Recipe ,NULL,NULL,NULL,10940,18
2929,Lepp Cookies I Recipe ,NULL,NULL,NULL,10942,36
2930,Rosettes II Recipe ,NULL,NULL,NULL,10943,18
2931,Famous Amos Chocolate Chip Cookies Recipe ,NULL,NULL,NULL,10944,72
2932,Chewy Peanut Butter Cookies Recipe ,NULL,NULL,NULL,10945,18
2933,Chewy Breakfast Bars Recipe ,NULL,NULL,NULL,10946,12
2934,Hedgehogs Recipe ,NULL,NULL,NULL,10947,12
2935,Pumpkin Cookies V Recipe ,NULL,NULL,NULL,10949,18
2936,Nut Rolls Recipe ,NULL,NULL,NULL,10950,35
2937,Ginger Crinkles Recipe ,NULL,NULL,NULL,10951,12
2938,Cornmeal Cookies II Recipe ,NULL,NULL,NULL,10953,24
2939,Cappuccino Flats Recipe ,15,12,410,10955,55
2940,Anise Cookies II Recipe ,NULL,NULL,NULL,10956,30
2941,Crunchies Recipe ,NULL,NULL,NULL,10957,30
2942,Nut Goody Bars Recipe ,NULL,NULL,NULL,10958,12
2943,Italian Almond Cookies I Recipe ,NULL,NULL,NULL,10960,24
2944,Biscotti Cookies Recipe ,NULL,NULL,NULL,10961,48
2945,Biscotti Dessert Cookies Recipe ,NULL,NULL,NULL,10962,24
2946,Rochelle Sable Recipe ,NULL,NULL,NULL,10964,12
2947,Soda Cracker Cookies Recipe ,NULL,NULL,NULL,10966,18
2948,Lepp Cookies II Recipe ,NULL,NULL,NULL,10967,48
2949,Macaroons II Recipe ,NULL,NULL,NULL,10968,36
2950,Popularity Cookies Recipe ,NULL,NULL,NULL,10969,12
2951,Cowboy Cookies I Recipe ,NULL,NULL,NULL,10970,84
2952,Pfeffernusse Cookies II Recipe ,NULL,NULL,NULL,10971,60
2953,Beer Cookies Recipe ,NULL,NULL,NULL,10972,36
2954,Powdered Sugar Cookies III Recipe ,NULL,NULL,NULL,10973,36
2955,Funky Frito Fruckies Recipe ,NULL,NULL,NULL,10974,18
2956,M,NULL,NULL,NULL,10975,24
2957,Baby Carrot Bars Recipe ,NULL,NULL,NULL,10976,24
2958,Chocolate Chip Shortbread Cookies I Recipe ,NULL,NULL,NULL,10977,18
2959,Soft Peanut Butter Cookies Recipe ,NULL,NULL,NULL,10978,12
2960,Macaroons III Recipe ,15,12,50,10979,60
2961,Nutty,NULL,NULL,NULL,10980,12
2962,Easy Chocolaty Brownies Recipe ,NULL,NULL,NULL,10981,30
2963,Chocolate Chip Cake Mix Cookies Recipe ,NULL,NULL,NULL,10982,60
2964,Giant Toffee Chocolate Chip Cookies Recipe ,NULL,NULL,NULL,10983,12
2965,Peanut Butter Haystacks Recipe ,NULL,NULL,NULL,10985,12
2966,Lavender Cookies Recipe ,NULL,NULL,NULL,10987,12
2967,Coconut Mountains Recipe ,NULL,NULL,NULL,10988,12
2968,Whole Wheat Snickerdoodles I Recipe ,NULL,NULL,NULL,10991,36
2969,Easy No Bake Cookies Recipe ,NULL,NULL,NULL,10992,48
2970,'Stef''s Whoopie Pies with Peanut Butter Frosting Recipe ',NULL,NULL,NULL,10994,6
2971,Monkey Peanut Butter Bars Recipe ,15,28,163,10996,12
2972,Peanuttiest Peanut Butter Cookies Recipe ,NULL,NULL,NULL,10997,18
2973,Graham Moist Lemon Bars Recipe ,NULL,NULL,NULL,11001,18
2974,Shaped Vanilla Cookies Recipe ,NULL,NULL,NULL,11002,12
2975,Peppermint Patty Brownies Recipe ,NULL,NULL,NULL,11003,12
2976,Nature Nuts Chewy Bars Recipe ,NULL,NULL,NULL,11005,12
2977,No Bake Deluxe Hamburger Cookies Recipe ,NULL,NULL,NULL,11006,6
2978,Sesame Seed Cookies II Recipe ,NULL,NULL,NULL,11007,18
2979,Chocolate Toffee Cookies II Recipe ,NULL,NULL,NULL,11008,18
2980,Double,NULL,NULL,NULL,11009,30
2981,Biscotti Toscani Recipe ,25,35,90,11010,42
2982,Cup of Everything Cookies Recipe ,NULL,NULL,NULL,11011,24
2983,Maple Walnut Bars Recipe ,NULL,NULL,NULL,11012,16
2984,Peanut Butter Cookies with Chocolate Chunks Recipe ,NULL,NULL,NULL,11014,12
2985,Devil Dogs Recipe ,NULL,NULL,NULL,11015,6
2986,Peanut Butter Carrot Cookies Recipe ,NULL,NULL,NULL,11016,48
2987,Pumpkin Bars II Recipe ,NULL,NULL,NULL,11017,12
2988,Carmelitas Recipe ,NULL,NULL,NULL,11018,36
2989,Mayonnaise Cookies Recipe ,NULL,NULL,NULL,11019,18
2990,Welsh Cakes Recipe ,NULL,NULL,NULL,11020,24
2991,Raisin Coconut Treasure Cookies Recipe ,NULL,NULL,NULL,11021,18
2992,'Sue''s Oatmeal Macadamia Nut Cookies Recipe ',NULL,NULL,NULL,11022,18
2993,Almond Crescents III Recipe ,NULL,NULL,NULL,11023,72
2994,Peanut Butter Balls IV Recipe ,NULL,NULL,NULL,11025,30
2995,Pistachio Chocolate Chip Cookies Recipe ,NULL,NULL,NULL,11027,42
2996,Chewy Maple Cookies Recipe ,NULL,NULL,NULL,11030,18
2997,Benne Cookies Recipe ,NULL,NULL,NULL,11031,42
2998,Oatmeal Craisin Cookies Recipe ,NULL,NULL,NULL,11032,24
2999,Evil Cookies Recipe ,NULL,NULL,NULL,11033,12
3000,Cinnamon Graham Crunchy Cookies Recipe ,NULL,NULL,NULL,11034,30
3001,Sweet Oatcakes Recipe ,NULL,NULL,NULL,11036,15
3002,Aebleskiver Recipe ,15,15,30,11037,30
3003,'Kristil''s Frat House Cookies Recipe ',NULL,NULL,NULL,11039,72
3004,The Ultimate Brownie Recipe ,20,45,65,11043,24
3005,Chocolate Cookie Pizza Recipe ,NULL,NULL,NULL,11044,16
3006,Power Bars Recipe ,NULL,NULL,NULL,11045,24
3007,'Mary''s Brownies Recipe ',20,30,50,11046,32
3008,Cherry Yum Yum Recipe ,NULL,NULL,NULL,11047,24
3009,Oatmeal Cocoa Macaroons Recipe ,NULL,NULL,NULL,11048,12
3010,Chocolate Chip Cookies Without Chocolate Chips Recipe ,NULL,NULL,NULL,11049,36
3011,Berry Crumb Bars Recipe ,NULL,NULL,NULL,11050,15
3012,Italian Almond Biscuits Recipe ,NULL,NULL,NULL,11051,48
3013,Angel Cookies II Recipe ,NULL,NULL,NULL,11052,36
3014,Caramel Brownies I Recipe ,NULL,NULL,NULL,11053,12
3015,'Grandmom''s Sand Tarts Recipe ',20,10,510,11054,72
3016,Old Time Soft Sugar Cookies Recipe ,10,15,30,11055,24
3017,Butter Icing for Sugar Cookies Recipe ,NULL,NULL,NULL,11056,8
3018,Gingerbread Cutouts Recipe ,NULL,NULL,NULL,11057,1
3019,Buttercream Icing Recipe ,15,NULL,15,11058,20
3020,Cranberry Crunch Squares Recipe ,NULL,NULL,NULL,11059,12
3021,Chocolate Madeleines Recipe ,NULL,NULL,NULL,11060,6
3022,'Julia''s Best Ever Chocolate Chip Cookies In A Jar Recipe ',NULL,NULL,NULL,11061,12
3023,Pudding Chocolate Chippers Recipe ,NULL,NULL,NULL,11062,36
3024,Deep Dish Brownies Recipe ,15,45,60,11063,9
3025,Cookie Jar Sugar Cookies Recipe ,NULL,NULL,NULL,11064,12
3026,Double Chocolate Nummies Recipe ,NULL,NULL,NULL,11065,30
3027,No Bake Cookies IV Recipe ,20,NULL,50,11066,36
3028,Chocolate Pinwheels Recipe ,NULL,NULL,NULL,11068,24
3029,Cookies with Chocbit Topping Recipe ,NULL,NULL,NULL,11069,4
3030,Chocolate Gingerbread Cookies Recipe ,NULL,NULL,NULL,11071,18
3031,Bourbon Pecan Shortbread Recipe ,NULL,NULL,NULL,11073,18
3032,Orange Balls II Recipe ,NULL,NULL,NULL,11076,36
3033,Peanut Butter Bars IV Recipe ,NULL,NULL,NULL,11077,18
3034,'Elsye''s Brownies Recipe ',NULL,NULL,NULL,11081,18
3035,Sugar Cookie Glaze Recipe ,NULL,NULL,NULL,11082,24
3036,Oatmeal,NULL,NULL,NULL,11085,24
3037,'Norway''s Best Pepper Cookies Recipe ',NULL,NULL,NULL,11086,30
3038,Really Basic Peanut Butter Cookies Recipe ,NULL,NULL,NULL,11087,36
3039,Butterscotch Bars I Recipe ,NULL,NULL,NULL,11089,30
3040,Buffalo Chip Cookies Recipe ,NULL,NULL,NULL,11090,24
3041,Old Time Popcorn Balls Recipe ,NULL,NULL,NULL,11091,15
3042,Cream Cheese Bars I Recipe ,NULL,NULL,NULL,11092,12
3043,Apple,NULL,NULL,NULL,11094,42
3044,Gingersnaps III Recipe ,NULL,NULL,NULL,11095,30
3045,Soldier Buttons Recipe ,NULL,NULL,NULL,11096,6
3046,Pride Of Iowa Cookies Recipe ,NULL,NULL,NULL,11099,18
3047,Gingerbread Cookie Frosting Recipe ,NULL,NULL,NULL,11102,4
3048,Buckeyes II Recipe ,NULL,NULL,NULL,11103,18
3049,Fudge Quickies Recipe ,NULL,NULL,NULL,11104,48
3050,Easy Cookies Recipe ,NULL,NULL,NULL,11107,48
3051,Christmas Cookies I Recipe ,NULL,NULL,NULL,11108,144
3052,Gallets Recipe ,NULL,NULL,NULL,11110,84
3053,Oatmeal Fruit Cookie Mix In A Jar Recipe ,NULL,NULL,NULL,11111,12
3054,Candy,NULL,NULL,NULL,11112,12
3055,Persimmon Cookies II Recipe ,NULL,NULL,NULL,11113,36
3056,Apricot Almond Rugalach Recipe ,NULL,NULL,NULL,11114,24
3057,Italian Wedding Cookies II Recipe ,20,45,120,11115,36
3058,Cream Cheese Sugar Cookies Recipe ,15,10,565,11116,72
3059,De,NULL,NULL,NULL,11118,16
3060,Zimtsterne Recipe ,40,6,46,11119,120
3061,Crazy Cookie Calzones Recipe ,NULL,NULL,NULL,11120,12
3062,Corn Flake Cookies I Recipe ,NULL,NULL,NULL,11121,96
3063,Sand Art Brownies Recipe ,20,NULL,20,11122,12
3064,Cat Poop Cookies I Recipe ,NULL,NULL,NULL,11123,12
3065,'Baker''s Clay Recipe ',NULL,NULL,NULL,11125,1
3066,Dough Ornament Recipe Recipe ,NULL,NULL,NULL,11126,1
3067,Non,NULL,NULL,NULL,11127,1
3068,Soft Molasses Cookies III Recipe ,NULL,NULL,NULL,11128,30
3069,Springerle IV Recipe ,45,8,1553,11130,48
3070,Cry Babies I Recipe ,NULL,NULL,NULL,11131,24
3071,Magic Cookie Bars III Recipe ,NULL,NULL,NULL,11132,96
3072,Lady Lock Filling I Recipe ,NULL,NULL,NULL,11133,32
3073,Gingerbread Cookie Mix in a Jar Recipe ,20,NULL,20,11135,18
3074,Old Fashioned Cookies Recipe ,NULL,NULL,NULL,11136,18
3075,Mosaic Cookies Recipe ,NULL,NULL,NULL,11137,18
3076,Spur Sugar Cookies Recipe ,NULL,NULL,NULL,11138,60
3077,Apricot Confection Recipe ,NULL,NULL,NULL,11139,24
3078,Cyclops Cookies Recipe ,NULL,NULL,NULL,11140,24
3079,Cookie Press Butter Cookies Recipe ,NULL,NULL,NULL,11141,48
3080,'Margie''s Shortbread Oatmeal Cookies Recipe ',NULL,NULL,NULL,11142,12
3081,'Canadian Shortbread  ''Eh'' Recipe ',NULL,NULL,NULL,11143,36
3082,Orange Peel Cookies Recipe ,NULL,NULL,NULL,11144,18
3083,Sesame Thumbprint Cookies Recipe ,NULL,NULL,NULL,11145,18
3084,Polish Christmas Cookies Recipe ,NULL,NULL,NULL,11147,72
3085,Christmas Logs Recipe ,NULL,NULL,NULL,11148,36
3086,Lacy Oatmeal Cookies Recipe ,15,10,55,11149,48
3087,Bourbon Balls I Recipe ,NULL,NULL,NULL,11150,36
3088,Ranger Joe Cookies Recipe ,NULL,NULL,NULL,11151,12
3089,Almond Butter Icing Recipe ,NULL,NULL,NULL,11152,32
3090,Pepper Cookies II Recipe ,NULL,NULL,NULL,11153,24
3091,Dutch Ice Box Cookies Recipe ,NULL,NULL,NULL,11154,30
3092,Molasses Crinkles Recipe ,NULL,NULL,NULL,11155,48
3093,Amariette Cookies Recipe ,NULL,NULL,NULL,11156,24
3094,Nut Filling for Kolacky Cookies Recipe ,NULL,NULL,NULL,11157,24
3095,Maple Pecan Crisps Recipe ,NULL,NULL,NULL,11158,24
3096,Banana Pudding Sugar Cookies Recipe ,15,10,155,11159,30
3097,Stroopwaffels I Recipe ,NULL,NULL,NULL,11160,12
3098,Chocolate Balls Recipe ,20,NULL,35,11161,36
3099,Buckeye Balls Recipe ,NULL,NULL,NULL,11162,18
3100,Florentines II Recipe ,NULL,NULL,NULL,11163,30
3101,Anise Drops Recipe ,NULL,NULL,NULL,11164,36
3102,Gingerbread Boys Recipe ,15,10,145,11165,60
3103,Gingerbread Recipe ,NULL,NULL,NULL,11166,24
3104,Minnesota Mail Carrier Cookies Recipe ,NULL,NULL,NULL,11167,18
3105,Italian Anise Toast Recipe ,NULL,NULL,NULL,11168,16
3106,Cinnamon Crisps Recipe ,NULL,NULL,NULL,11169,30
3107,Tiny Tarts Recipe ,30,30,120,11170,12
3108,Snowballs II Recipe ,30,15,45,11171,30
3109,Cookie Mold Sugar Cookies Recipe ,NULL,NULL,NULL,11172,48
3110,Montecados (Spanish Cookies) Recipe ,NULL,NULL,NULL,11173,72
3111,Extra Easy Fudge Recipe ,NULL,NULL,NULL,11174,48
3112,Foolproof Chocolate Fudge Recipe ,NULL,NULL,NULL,11175,12
3113,Easy Peanut Butter Fudge Recipe ,NULL,NULL,NULL,11176,24
3114,Remarkable Fudge Recipe ,NULL,NULL,NULL,11177,58
3115,Snowflake Cookies Recipe ,30,10,100,11178,12
3116,Child,NULL,NULL,NULL,11179,48
3117,Ginger Cream Cookies Recipe ,NULL,NULL,NULL,11180,24
3118,Fruit Foldovers Recipe ,NULL,NULL,NULL,11181,48
3119,Chocolate Chip Pudding Cookies Recipe ,NULL,NULL,NULL,11182,36
3120,Crunchy Chip Cookies Recipe ,NULL,NULL,NULL,11183,18
3121,Decorator Frosting Recipe ,10,NULL,10,11184,16
3122,Holly Berry Cookies Recipe ,NULL,NULL,NULL,11185,12
3123,Original Cheese Tempters Recipe ,NULL,NULL,NULL,11186,30
3124,Holiday Butter Cookies Recipe ,NULL,NULL,NULL,11187,36
3125,Egg Paint Recipe ,NULL,NULL,NULL,11188,1
3126,Soft Ginger Cut,NULL,NULL,NULL,11189,36
3127,'Mrs. Ronzo''s Lemon Balls Recipe ',NULL,NULL,NULL,11190,48
3128,Deep Dish Fudge Brownies Recipe ,NULL,NULL,NULL,11191,9
3129,Matrimonial Bars Recipe ,NULL,NULL,NULL,11192,24
3130,Crescent Tarts Recipe ,NULL,NULL,NULL,11193,12
3131,Chewy Noel Cookies Recipe ,NULL,NULL,NULL,11194,12
3132,Angel Chocolate Chip Cookies Recipe ,10,10,25,11195,24
3133,Pill Bottle Cookies Recipe ,NULL,NULL,NULL,11196,30
3134,Kookie Brittle Recipe ,NULL,NULL,NULL,11197,30
3135,Spritz Orange Crisps Recipe ,NULL,NULL,NULL,11198,42
3136,Anisette Cookies I Recipe ,NULL,NULL,NULL,11199,72
3137,Golden Sesame Cookies Recipe ,NULL,NULL,NULL,11200,24
3138,Banana Chocolate Chip Cookies Recipe ,15,15,75,11201,18
3139,Oatmeal Cherry Walnut Cookies Recipe ,NULL,NULL,NULL,11202,48
3140,Chocolate Chocolate Chip Cake Cookies Recipe ,NULL,NULL,NULL,11203,24
3141,Soft Sugar Cookies III Recipe ,NULL,NULL,NULL,11204,30
3142,Waffle Iron Brownies Recipe ,NULL,NULL,NULL,11205,10
3143,One Hundred Thousand Calorie Bars Recipe ,NULL,NULL,NULL,11206,24
3144,Butter Cookies IV Recipe ,NULL,NULL,NULL,11207,18
3145,'Julie''s Famous Chocolate Chip Cookies Recipe ',NULL,NULL,NULL,11208,36
3146,Triple Layer Cookie Bars Recipe ,NULL,NULL,NULL,11209,24
3147,Wine Cookies (Original Italian) Recipe ,NULL,NULL,NULL,11210,36
3148,Candy Bar Squares Recipe ,NULL,NULL,NULL,11212,12
3149,Classic Butter Cookies I Recipe ,NULL,NULL,NULL,11213,96
3150,Eggless Peanut Butter Cookies Recipe ,NULL,NULL,NULL,11214,24
3151,Benne Wafers Recipe ,NULL,NULL,NULL,11215,36
3152,Cornflake Cookies II Recipe ,NULL,NULL,NULL,11216,18
3153,Surprise Meringues Recipe ,NULL,NULL,NULL,11217,12
3154,Skillet Cookies I Recipe ,NULL,NULL,NULL,11218,24
3155,Cornflake Macaroons Recipe ,NULL,NULL,NULL,11219,24
3156,Holiday Fruit Drops Recipe ,NULL,NULL,NULL,11220,48
3157,Fruitcake Cookies II Recipe ,NULL,NULL,NULL,11221,48
3158,'Hilda''s Icebox Cookies Recipe ',NULL,NULL,NULL,11222,84
3159,Cherry Winks Recipe ,NULL,NULL,NULL,11223,30
3160,'Grandma''s Apple Cookies Recipe ',NULL,NULL,NULL,11224,18
3161,French Cream Filling Recipe ,NULL,NULL,NULL,11225,16
3162,Butter Almond Cookies Recipe ,NULL,NULL,NULL,11226,18
3163,'Firefighter''s Favorite Chocolate Chip Cookie Recipe ',NULL,NULL,NULL,11227,30
3164,Caramel Cup Tassies Recipe ,NULL,NULL,NULL,11228,12
3165,Puppy Chow I Recipe ,20,10,30,11229,12
3166,Puppy Chow II Recipe ,20,10,30,11230,12
3167,Scrumdiddlyumptious Fudgy Caramel Chews Recipe ,NULL,NULL,NULL,11231,16
3168,Classic Butter Cookies II Recipe ,NULL,NULL,NULL,11232,48
3169,Homemade Condensed Milk Recipe ,NULL,NULL,NULL,11233,4
3170,Sweetened Condensed Milk Recipe ,5,15,20,11234,4
3171,Swedish Cream Wafers Recipe ,NULL,NULL,NULL,11235,30
3172,Aunt Betz Cookies Recipe ,NULL,NULL,NULL,11236,24
3173,Brown Butter Cookies Recipe ,30,10,80,11237,60
3174,Melt In Your Mouth Peanut Butter Cookies Recipe ,NULL,NULL,NULL,11238,36
3175,Triple Chocolate Chunk Cookie Recipe ,NULL,NULL,NULL,11239,18
3176,Vanilla or Chocolate Tuiles Recipe ,45,8,120,11240,12
3177,Potato Chip Cookies III Recipe ,NULL,NULL,NULL,11241,24
3178,Caramel Brownies II Recipe ,NULL,NULL,NULL,11242,18
3179,Swedish Tea Cookies Recipe ,NULL,NULL,NULL,11243,30
3180,Ginger Biscotti with Pistachios Recipe ,NULL,NULL,NULL,11244,18
3181,Half Moon Cookies Recipe ,NULL,NULL,NULL,11245,20
3182,Orange Cookies II Recipe ,NULL,NULL,NULL,11246,18
3183,Coconut Rosette Recipe ,NULL,NULL,NULL,11247,36
3184,Savoiardi I Recipe ,45,15,60,11248,24
3185,Mostaccioli for Basilica Recipe ,NULL,NULL,NULL,11249,12
3186,Egyptian Rose Leaves Recipe ,NULL,NULL,NULL,11251,36
3187,Kringla Recipe ,NULL,NULL,NULL,11252,36
3188,Mock Peanut Brittle Recipe ,NULL,NULL,NULL,11253,24
3189,Chewy Gingersnaps Recipe ,NULL,NULL,NULL,11254,18
3190,Chocolate Biscuits Recipe ,NULL,NULL,NULL,11255,6
3191,Half Moons II Recipe ,NULL,NULL,NULL,11256,24
3192,Poppy Seed Cookies II Recipe ,NULL,NULL,NULL,11258,24
3193,Hello Dollies I Recipe ,15,30,45,11259,24
3194,Italian Bowknot Cookies Recipe ,60,30,150,11260,24
3195,Orange Cream Cookies Recipe ,20,12,75,11261,48
3196,Royal Coconut Cookies Recipe ,NULL,NULL,NULL,11262,24
3197,Orange Cream Cookie Mix Recipe ,NULL,NULL,NULL,11263,30
3198,Lebkuchen (Lep Kuchen) Recipe ,NULL,NULL,NULL,11264,24
3199,Peanut Butter Fudge I Recipe ,NULL,NULL,NULL,11265,48
3200,'Michelle''s Soft Sugar Cookies Recipe ',NULL,NULL,NULL,11267,60
3201,Baseball Bars Recipe ,NULL,NULL,NULL,11268,20
3202,Oatsies Recipe ,NULL,NULL,NULL,11269,9
3203,Cherry Rum Balls Recipe ,NULL,NULL,NULL,11270,24
3204,Onesy,NULL,NULL,NULL,11271,18
3205,Oatmeal Carmelitas Recipe ,NULL,NULL,NULL,11272,36
3206,Thumbprint Kisses Recipe ,NULL,NULL,NULL,11273,36
3207,Chow Mein Clusters Recipe ,15,NULL,30,11275,24
3208,Potato Chip Cookies IV Recipe ,NULL,NULL,NULL,11276,60
3209,Walnut Lace Cookies Recipe ,NULL,NULL,NULL,11277,36
3210,Orange Cookies III Recipe ,NULL,NULL,NULL,11280,36
3211,Gingerbread Cookies I Recipe ,30,12,60,11281,60
3212,Butterfinger Cookies Recipe ,NULL,NULL,NULL,11282,24
3213,Hazelnut Caramel Cookies Recipe ,NULL,NULL,NULL,11283,24
3214,Pina Colada Cookies I Recipe ,NULL,NULL,NULL,11284,48
3215,Nordy Bars Recipe ,NULL,NULL,NULL,11286,12
3216,Mexican Cookie Rings Recipe ,NULL,NULL,NULL,11287,12
3217,Egg Free Chocolate Chip Pumpkin Cookies Recipe ,NULL,NULL,NULL,11288,48
3218,Lemon Poppy Seed Biscotti Recipe ,NULL,NULL,NULL,11289,36
3219,White Chocolate Coconut Macadamia Cookies Recipe ,NULL,NULL,NULL,11290,36
3220,Brazilian Coffee Cookies Recipe ,NULL,NULL,NULL,11292,24
3221,Cappuccino Biscotti Recipe ,NULL,NULL,NULL,11293,12
3222,Spoon Cookies Recipe ,NULL,NULL,NULL,11294,6
3223,White Velvet Cutouts Recipe ,NULL,NULL,NULL,11295,36
3224,Haystacks III Recipe ,NULL,NULL,NULL,11296,24
3225,Raw Brownies Recipe ,NULL,NULL,NULL,11297,16
3226,'Gramma''s Date Squares Recipe ',25,25,50,11298,12
3227,Lemon Sugar Tea Cookies Recipe ,25,12,120,11299,48
3228,Happy Dreams Cookies Recipe ,NULL,NULL,NULL,11300,30
3229,Almond Coconut Chocolate Cookie Balls Recipe ,NULL,NULL,NULL,11301,48
3230,Glazed Rum Cookies Recipe ,NULL,NULL,NULL,11302,24
3231,Oatmeal Butterscotch Cookies Recipe ,15,10,25,11303,48
3232,Homemade Dog Biscuits Recipe ,NULL,NULL,NULL,11304,84
3233,Chewy Rolo Cookie Bars Recipe ,NULL,NULL,NULL,11305,36
3234,Chewiest Brownies Recipe ,NULL,NULL,NULL,11306,24
3235,Caramel Oatmeal Pudding Cookies Recipe ,12,NULL,12,11307,48
3236,Pecan Pie Surprise Bars Recipe ,NULL,NULL,NULL,11308,18
3237,Rocky Road Squares Recipe ,NULL,NULL,NULL,11309,32
3238,Cinnamon Sugar Butter Cookies II Recipe ,NULL,NULL,NULL,11310,18
3239,Cornmeal Cookies III Recipe ,NULL,NULL,NULL,11313,36
3240,Delicious Raspberry Oatmeal Cookie Bars Recipe ,15,40,55,11314,9
3241,Bow Tie Cookies Recipe ,NULL,NULL,NULL,11315,36
3242,Jelly Cookies Recipe ,NULL,NULL,NULL,11316,18
3243,Easter Story Cookies Recipe ,NULL,NULL,NULL,11317,24
3244,'Mom''s Walnut Bars Recipe ',20,35,55,11318,18
3245,Christmas Orange Rind Cut,NULL,NULL,NULL,11320,48
3246,'Mom''s Cookies Recipe ',NULL,NULL,NULL,11321,48
3247,Mock Babe Ruth Bars Recipe ,NULL,NULL,NULL,11322,24
3248,Chocolate Pecan Sandies Recipe ,15,20,65,11324,24
3249,Fresh Strawberry Cookies Recipe ,NULL,NULL,NULL,11325,24
3250,Easy and Fun Peanut Butter Balls Recipe ,NULL,NULL,NULL,11328,12
3251,Crisp Rice Chocolate Chip Cookies Recipe ,NULL,NULL,NULL,11329,18
3252,'Christie B''s Fabulous Cherry Cookies Recipe ',NULL,NULL,NULL,11330,24
3253,Pumpkin Whoopie Pies Recipe ,NULL,NULL,NULL,11331,18
3254,Oatmeal Whoopie Pies Recipe ,NULL,NULL,NULL,11332,18
3255,Butterfinger Chunkies Recipe ,NULL,NULL,NULL,11333,12
3256,Sour Cream Raisin Cookies Recipe ,NULL,NULL,NULL,11335,30
3257,Low Fat Cocoa Cookies Recipe ,NULL,NULL,NULL,11336,20
