,Recipe Name,Prepare Time,Cook Time,Total Time,RecipeID,Servings
9024,Leftover Casserole Recipe ,10,45,55,20502,8
9025,Best Ever Hot Artichoke Dip Recipe ,5,45,50,20503,20
9026,Warm and Spicy Autumn Punch Recipe ,20,40,60,20505,16
9027,Yummy Strawberry Shake Recipe ,10,NULL,10,20506,1
9028,Zima Plus Recipe ,1,NULL,1,20508,1
9029,Best Ever Party Appetizer Recipe ,20,NULL,380,20509,10
9030,Spinach Salad with Peaches and Pecans Recipe ,10,10,20,20517,4
9031,Bacon Cheese Treats Recipe ,7,15,25,20518,8
9032,Best Ever Popcorn Balls Recipe ,10,10,20,20519,20
9033,Big Germans  Recipe ,10,15,25,20520,4
9034,'Amy''s Healthy Fruity Recipe ',10,NULL,10,20521,4
9035,Manifold Stew Recipe ,20,40,60,20522,NULL
9036,Zucchini Appetizer Recipe ,10,20,30,20523,40
9037,Flan II Recipe ,10,60,70,20524,4
9038,Christmas Punch Recipe ,15,NULL,135,20529,20
9039,Blue Monday Dip Recipe ,5,NULL,10,20530,24
9040,Bread and Butter Pickles I Recipe ,15,10,25,20531,8
9041,Delicious Fish Smoothies Recipe ,5,NULL,10,20532,NULL
9042,Electric Lemonade Recipe ,2,NULL,2,20533,1
9043,Sioux Indian Pudding Recipe ,15,120,135,20536,4
9044,Fruit Salad Recipe ,5,NULL,5,20537,1
9045,Gluehwein Recipe ,10,35,45,20538,6
9046,'Adrienne''s Tom Ka Gai Recipe ',15,45,60,20539,4
9047,Bruschetta Toast Recipe ,15,3,20,20541,10
9048,Apple Snack Squares Recipe ,30,40,70,20542,24
9049,Irish Cream Liqueur I Recipe ,5,NULL,5,20544,16
9050,Bruschetta III Recipe ,5,7,12,20545,6
9051,Bruschetta al Pomodoro Recipe ,20,5,25,20547,12
9052,'Ceil''s Cucumber Slices Recipe ',30,20,50,20548,32
9053,Jamaica Coffee Recipe ,5,NULL,5,20549,1
9054,Extra Special Banana Pudding Recipe ,15,45,60,20550,15
9055,Kamikaze Recipe ,5,NULL,5,20551,1
9056,Luau Punch Recipe ,10,NULL,10,20552,10
9057,Meat Marinade Recipe ,5,NULL,5,20553,6
9058,Milky Tea Recipe ,1,2,4,20554,1
9059,Puff Balls Recipe ,10,4,15,20555,32
9060,Smoked Herb Chicken Recipe ,15,240,255,20557,8
9061,Rice Pudding I Recipe ,NULL,60,60,20558,15
9062,Tri,5,NULL,5,20559,6
9063,Old,10,NULL,10,20560,12
9064,Peach Cooler Recipe ,10,NULL,10,20561,2
9065,Red Snapper Recipe ,1,NULL,1,20563,1
9066,Summer Afternoon Recipe ,120,NULL,120,20564,4
9067,Raspberry Mousse Cheesecake Recipe ,15,25,40,20565,12
9068,Manicotti Pancakes II Recipe ,5,10,15,20566,12
9069,'Dave''s Ultimate Guacamole Recipe ',25,NULL,25,20569,8
9070,Delicious Dip Recipe ,20,NULL,20,20570,24
9071,Thanksgiving Turkey Recipe ,2,NULL,2,20571,1
9072,Dill Dip I Recipe ,10,NULL,10,20572,16
9073,Vodka Blueberry Liqueur Recipe ,10,NULL,10,20574,30
9074,Cheesy Shrimp Meltaways Recipe ,15,10,25,20576,12
9075,Wassail Punch Recipe ,5,480,485,20577,12
9076,Yummy Margaritas Recipe ,5,NULL,5,20579,2
9077,Apple Orchard Punch Recipe ,10,NULL,10,20580,12
9078,Reuben Sandwich II Recipe ,15,2,17,20581,4
9079,Homemade Vanilla Pudding Recipe ,NULL,20,60,20586,5
9080,The Popcorn Cake Recipe ,10,10,30,20587,14
9081,'T''s Easy Chicken Recipe ',10,15,25,20589,4
9082,E,15,NULL,165,20591,10
9083,Broccoli Beef I Recipe ,15,15,30,20593,4
9084,Cold Veggie Squares Recipe ,10,15,25,20594,16
9085,Onion Salmon Recipe ,10,15,25,20599,4
9086,Cucumber Dip Recipe ,10,NULL,490,20600,20
9087,Russian Creme Fruit Topping Recipe ,5,NULL,5,20602,16
9088,Cheesy Chili Dip I Recipe ,15,30,45,20603,6
9089,Corned Beef on Toast Recipe ,10,10,20,20604,4
9090,Cheese Onion Garlic Bread Recipe ,15,5,20,20605,8
9091,Chicken a la King III Recipe ,10,20,30,20606,4
9092,Leftover Oven Barbequed Chicken Recipe ,5,25,30,20607,5
9093,Super Simple Oven Barbequed Chicken Recipe ,10,90,100,20608,6
9094,Apple Banana Smoothie Recipe ,5,NULL,5,20610,2
9095,Beverage Cubes Recipe ,1,NULL,1,20613,12
9096,Cedarwood Recipe ,5,NULL,5,20614,1
9097,Clam Dip Recipe ,5,20,25,20615,12
9098,Diva Colada Recipe ,5,NULL,10,20616,2
9099,Steak Sauce Recipe ,5,NULL,5,20617,12
9100,Teriyaki Marinade Recipe ,10,NULL,10,20619,12
9101,Electric Strawberry Recipe ,1,NULL,1,20620,1
9102,Cottage Meatloaf Recipe ,15,45,65,20621,8
9103,Fresh Lemonade Recipe ,10,NULL,10,20625,6
9104,Golden Rays of Peach Delight Recipe ,2,NULL,2,20626,1
9105,Handsome Party Punch Recipe ,10,NULL,10,20627,24
9106,Iced Tea I Recipe ,15,NULL,15,20628,12
9107,Kool Ade Punch Recipe ,10,NULL,10,20629,24
9108,Lady Joy Recipe ,1,NULL,1,20630,1
9109,Margarita Made Easy Recipe ,2,NULL,2,20631,4
9110,Citrus Slush Recipe ,5,NULL,10,20632,4
9111,Raspberry Refresher Recipe ,5,NULL,8,20635,4
9112,Sassy Sangria Recipe ,10,NULL,10,20636,32
9113,Tequini Recipe ,4,NULL,4,20637,1
9114,Very Fruity Rum Punch Recipe ,10,NULL,10,20638,24
9115,Wedding Day Punch Recipe ,5,NULL,5,20639,25
9116,Yummy Pink Punch Recipe ,5,NULL,5,20640,24
9117,Three Bean Salad I Recipe ,30,3,35,20642,10
9118,Banana Meatloaf Recipe ,10,60,70,20643,6
9119,Loosemeat Sandwiches II Recipe ,NULL,15,15,20647,6
9120,Three Bean Salad II Recipe ,25,5,90,20649,4
9121,Cocktail Birthday Cake Recipe ,320,NULL,320,20650,24
9122,Zucchini Cheese Garlic Appetizer Recipe ,10,25,35,20652,18
9123,'Valerie''s Fruit Dip Recipe ',15,NULL,15,20653,6
9124,'Bonnie''s Fruit Dip Recipe ',15,NULL,15,20655,10
9125,'Carla''s Fruit Dip Recipe ',10,NULL,10,20657,10
9126,Apple Pie Bread Recipe ,15,80,95,20658,12
9127,Twice Baked Potatoes Recipe ,15,75,90,20659,4
9128,Creamy Peanut Towers Recipe ,5,NULL,5,20660,9
9129,Mississippi Hot Caviar Recipe ,12,NULL,812,20661,15
9130,Zucchini Apple Bread Recipe ,20,60,80,20663,24
9131,Easy Nacho Dip Recipe ,15,NULL,15,20664,24
9132,Aloha Coleslaw Recipe ,15,NULL,65,20665,8
9133,Texas Coleslaw Recipe ,15,NULL,75,20666,8
9134,Blackberry,20,60,80,20667,8
9135,Green Bean and Feta Salad Recipe ,30,5,275,20668,5
9136,Double Tomato Bruschetta Recipe ,15,7,35,20669,12
9137,Drunken Stuffed Figs Recipe ,45,NULL,45,20671,12
9138,Yummy Artichoke Dip Recipe ,10,25,35,20672,32
9139,Glazed Meatloaf II Recipe ,10,70,80,20673,8
9140,Meatloaf Supreme Recipe ,10,60,70,20674,NULL
9141,Rempel Family Meatloaf Recipe ,10,45,55,20675,6
9142,Breakfast Burritos de Frank Recipe ,10,20,30,20677,8
9143,Ham and Corn Beignets Recipe ,15,15,30,20678,8
9144,Easy Mexican Casserole Recipe ,20,30,50,20680,6
9145,Tasty Meat Pie Recipe ,NULL,45,45,20681,12
9146,Mexicorn Recipe ,20,NULL,20,20683,7
9147,Banana Blast I Recipe ,5,NULL,5,20685,2
9148,Basic Margarita Recipe ,3,NULL,5,20686,4
9149,Bordeaux Martini Recipe ,3,NULL,3,20688,4
9150,Champagne Peach Punch Recipe ,10,NULL,10,20693,24
9151,Asiago Toasted Cheese Puffs Recipe ,10,3,13,20694,12
9152,Berry Blend Salad Recipe ,20,NULL,20,20695,6
9153,Breakfast Cake Recipe ,15,45,60,20696,12
9154,Orange Cream Milkshake Recipe ,10,5,15,20698,2
9155,Exotic Fruit Drink Recipe ,5,120,125,20699,4
9156,Broccoli and Cheese Brunch Casserole Recipe ,15,55,80,20700,8
9157,Breakfast Casserole II Recipe ,15,60,75,20701,12
9158,Cheddar Bacon Dip Recipe ,5,20,25,20702,8
9159,Best Ever Layered Mexican Dip Recipe ,15,NULL,20,20707,32
9160,Cheesecake Dip Recipe ,15,NULL,75,20714,16
9161,Chicken Cheese Ball Recipe ,15,NULL,75,20715,15
9162,Crispy Corn and Rice Treats Recipe ,15,NULL,15,20716,12
9163,Creamy Chili Sauce Recipe ,10,NULL,10,20719,32
9164,Garlic Herbed Chicken Recipe ,10,60,70,20721,4
9165,Creamy Fruit Dip Recipe ,5,NULL,5,20722,24
9166,Easiest Teriyaki Marinade Ever Recipe ,10,NULL,130,20723,8
9167,Grilled Corn on the Cob Recipe ,10,30,40,20724,6
9168,'Glenn''s Marinated Pork Shoulder Recipe ',15,180,435,20725,8
9169,Cucumber Salsa  Recipe ,15,NULL,135,20726,48
9170,Frozen Lime Daiquiri Recipe ,5,NULL,5,20728,6
9171,Easy Hummus Recipe ,5,NULL,5,20730,16
9172,Gourmet Root Beer Float Recipe ,2,NULL,2,20731,2
9173,Super Hot Cereal Mix Recipe ,10,NULL,10,20734,10
9174,Easy Snack Wraps Recipe ,15,NULL,15,20735,60
9175,Egg and Olive Crostini Recipe ,20,10,30,20736,16
9176,Fabulous and Easy Guacamole Recipe ,10,NULL,25,20738,16
9177,Cantonese Lean Pork Congee Recipe ,25,45,70,20741,4
9178,'Claire''s Yummy Crepes Recipe ',5,5,10,20743,3
9179,Different Chicken Divan Recipe ,15,30,45,20747,10
9180,Country Style Fried Potatoes Recipe ,10,15,25,20749,6
9181,Crab and Swiss Quiche Recipe ,15,40,55,20750,8
9182,Incredible Punch Recipe ,10,NULL,10,20753,50
9183,Hot Chocolate Recipe ,3,10,15,20754,3
9184,'Finger Lickin'' Rock and Roll Artichokes Recipe ',10,NULL,10,20756,24
9185,Beef or Chicken Marinade Recipe ,10,NULL,250,20759,12
9186,Cajun Boiled Peanuts Recipe ,5,480,485,20760,32
9187,Key Lime Pie Recipe ,5,NULL,5,20761,2
9188,California Coleslaw Recipe ,20,NULL,20,20762,6
9189,Garlic Pepper Steak Recipe ,10,20,30,20763,6
9190,Honey Smoked Turkey Recipe ,30,195,225,20764,16
9191,Lemon Mint Cooler Recipe ,5,NULL,5,20765,4
9192,Melocoton con Limon Recipe ,5,NULL,5,20767,1
9193,Garlic Herb Grilled Pork Tenderloin Recipe ,15,60,75,20768,4
9194,Orange Drink Recipe ,10,NULL,10,20769,8
9195,Quite a Peachy Pour Recipe ,10,NULL,10,20770,4
9196,Cool Veggie Pizza Recipe ,20,12,90,20771,10
9197,Rum Rollover Recipe ,3,NULL,3,20774,1
9198,Sao Paulo Lime and Vodka Recipe ,5,NULL,5,20775,1
9199,Tart and Bubbly Wedding Punch Recipe ,15,NULL,15,20776,24
9200,Wonderful Margaritas Recipe ,15,NULL,15,20777,12
9201,Chicken Adobo I Recipe ,15,60,75,20779,5
9202,Crab Dip I Recipe ,10,NULL,70,20782,12
9203,Creamy Sausage Dip Recipe ,10,20,30,20783,24
9204,Apple Fritters I Recipe ,25,10,35,20786,20
9205,Corn Fritters Southern Style Recipe ,20,30,50,20788,10
9206,Tzatziki II Recipe ,10,NULL,40,20790,4
9207,Cashew Raisin Rice Pilaf Recipe ,15,30,45,20791,12
9208,'B and L''s Strawberry Smoothie Recipe ',5,1,6,20792,2
9209,Broccoli Tofu Pitas Recipe ,2,15,17,20794,2
9210,Apricot Brandy Cake Recipe ,15,55,75,20795,16
9211,Extra Easy Hummus Recipe ,5,NULL,5,20797,4
9212,Fry Sauce Recipe ,5,NULL,5,20800,8
9213,Tangy Tuna Recipe ,5,10,15,20802,1
9214,Monte Cristo Sandwich Recipe ,5,15,20,20803,1
9215,Banana Shake Recipe ,5,NULL,5,20804,2
9216,Crantini Recipe ,1,NULL,1,20806,1
9217,Kettle Corn Recipe ,5,15,20,20808,5
9218,Avocado Soup with Chicken and Lime Recipe ,10,20,30,20809,4
9219,Belly Burner Chili Recipe ,25,480,505,20810,8
9220,Delicious Healthy Strawberry Shake Recipe ,10,NULL,10,20816,2
9221,Slow Cooker Pork Recipe ,5,480,485,20817,8
9222,Carrot Bread II Recipe ,15,60,75,20818,20
9223,Venison Vegetable Soup Recipe ,30,90,120,20819,8
9224,Cocktail Wieners II Recipe ,5,5,10,20820,8
9225,Liverwurst Recipe ,15,60,75,20823,48
9226,Corn Relish I Recipe ,20,5,25,20824,32
9227,French Apple Pie Icing Recipe ,5,NULL,5,20826,8
9228,Tzatziki Sauce I Recipe ,5,NULL,5,20827,12
9229,Tzatziki Sauce II Recipe ,360,NULL,360,20830,24
9230,Tzatziki Recipe ,20,NULL,380,20831,32
9231,'Pickled Pig''s Feet III Recipe ',25,60,865,20841,8
9232,Easy Lemonade Recipe ,10,5,15,20842,8
9233,Freeze,5,NULL,5,20843,1
9234,'Grandma''s Strawberry Milkshake Recipe ',1,NULL,5,20844,1
9235,Welsh Rarebit II Recipe ,10,20,30,20845,4
9236,Watermelon Fire and Ice Salsa Recipe ,15,NULL,15,20846,32
9237,Heavenly Mudslides Recipe ,5,NULL,10,20847,4
9238,Waynesboroughs Recipe ,30,NULL,30,20848,10
9239,Baked French Fries I Recipe ,5,45,50,20849,1
9240,Ice Cream Brandy Punch Recipe ,6,NULL,6,20850,6
9241,Taco in a Bag Recipe ,5,10,15,20852,4
9242,Slow Cooked Baked Beans Recipe ,15,675,690,20853,8
9243,Bifana Recipe ,20,30,50,20855,4
9244,'Uncle Howie''s Favorite Artichoke Dip Recipe ',15,NULL,15,20856,40
9245,'Shelia''s Dip Recipe ',15,NULL,135,20857,48
9246,Best Ever Jalapeno Poppers Recipe ,45,15,60,20858,32
9247,Artichoke Dip I Recipe ,10,30,45,20859,40
9248,Hatteras Style Clam Chowder Recipe ,20,30,50,20860,8
9249,Cheesy Creamed Spinach Casserole Recipe ,10,25,35,20861,9
9250,Santa Fe Veggie Quesadillas Recipe ,5,5,10,20865,4
9251,Seared Sea Scallops Recipe ,15,15,30,20872,4
9252,Fish in a Red Sauce Recipe ,15,20,45,20873,6
9253,Sea Bass Barbecue Recipe ,5,15,20,20874,2
9254,Crustless Spinach Quiche Recipe ,20,30,50,20876,6
9255,Quick and Easy Apple Muffins Recipe ,10,20,30,20878,12
9256,'Donna''s Cheesy Quiche Recipe ',20,40,60,20879,6
9257,Dutch Babies I Recipe ,5,20,25,20880,8
9258,Wonton Wrappers Recipe ,30,NULL,30,20881,72
9259,Won Ton Wrapper Appetizers Recipe ,15,20,35,20883,60
9260,Apple Cheese Pizza Recipe ,10,30,40,20885,8
9261,Homemade Coleslaw Recipe ,25,NULL,25,20886,8
9262,Sugar Free Strawberry Jiffy Jam Recipe ,5,15,20,20888,24
9263,Buffalo Chicken Sauce Recipe ,10,30,40,20891,24
9264,Seven,30,50,80,20892,12
9265,Chicken Chimi in the Oven Recipe ,25,25,50,20894,6
9266,Creamy White Wine Sauce Recipe ,NULL,15,15,20895,8
9267,Georgia Caviar Recipe ,15,90,585,20897,12
9268,Okra and Tomatoes Recipe ,10,20,30,20899,6
9269,Easter Breakfast Casserole Recipe ,25,75,100,20900,12
9270,Easy French Toast Recipe ,5,10,15,20901,2
9271,Baked Pineapple Side Dish Recipe ,15,45,60,20904,6
9272,Escargot Mushrooms Recipe ,5,5,10,20905,6
9273,Doctor Bird Cake Recipe ,20,90,120,20906,16
9274,Henry Bain Sauce Recipe ,30,NULL,30,20909,128
9275,Salsa Ninety Nine (Mild) Recipe ,60,120,180,20910,80
9276,Pineapple Muffins Recipe ,10,20,30,20912,12
9277,Easy Sausage Strata Recipe ,20,70,600,20913,8
9278,Egg and Sausage Casserole Recipe ,15,35,50,20916,12
9279,Egg and Hash Brown Pie Recipe ,15,45,65,20917,8
9280,Fast and Easy Pancakes Recipe ,5,15,20,20918,6
9281,Candied Apples I Recipe ,NULL,20,30,20924,8
9282,Chicken Bouillon Rice Recipe ,NULL,20,20,20925,8
9283,Noodles and Veggies Recipe ,NULL,20,20,20927,4
9284,Apple Dumplings II Recipe ,20,35,55,20929,6
9285,Banana Muffins I Recipe ,10,20,30,20933,12
9286,Booyah Chicken Recipe ,20,150,170,20936,12
9287,French Toast Stars Recipe ,10,15,25,20937,4
9288,Simple Beef Flavored Gravy Recipe ,5,10,15,20938,6
9289,Zucchini Sticks Recipe ,25,15,40,20940,24
9290,Broccoli Slaw Recipe ,5,NULL,5,20941,12
9291,Beer Battered Onion Rings Recipe ,10,15,25,20942,6
9292,Mexi Tatoes Recipe ,10,30,40,20943,6
9293,Eggplant con Queso Recipe ,10,30,40,20944,3
9294,Orange Surprise Recipe ,10,NULL,10,20946,2
9295,Cinnamon Pear Frozen Yogurt Recipe ,5,NULL,45,20948,8
9296,Lau Lau Recipe ,30,240,270,20954,4
9297,Mashed Potato Miracle Recipe ,5,60,65,20955,5
9298,Zucchini Casserole I Recipe ,15,60,75,20959,6
9299,Easy Bakewell Tarts Recipe ,30,30,60,20960,24
9300,Banana Pudding II Recipe ,15,15,30,20961,4
9301,Oven Roasted Potatoes Recipe ,15,30,45,20963,4
9302,Oven Kalua Pork Recipe ,30,300,330,20964,12
9303,Cherry Cake Recipe ,15,50,65,20965,9
9304,Zesty Tomato Soup for One Recipe ,5,10,20,20968,1
9305,Welsh Rabbit  Recipe ,5,15,20,20970,6
9306,'Big John''s BBQ Ribs and Dry Spice Rub Recipe ',20,180,440,20971,4
9307,Pumpkin Ice Cream Recipe ,20,NULL,60,20973,18
9308,Chicken Kabobs Recipe ,15,15,30,20974,4
9309,Way Easy Pizza Sauce/Bread Stick Dip Recipe ,5,NULL,5,20977,16
9310,Eastern North Carolina Barbeque Sauce Recipe ,10,NULL,190,20978,64
9311,Spanish Flan  Recipe ,20,60,80,20979,8
9312,Fiery Pork Skewers Recipe ,15,12,30,20980,4
9313,Water Chestnut Dip Recipe ,10,NULL,130,20981,28
9314,Grilled Cheese and Bacon Potatoes Recipe ,15,30,45,20982,4
9315,Easy Bake Oven Cake Mix Recipe ,15,15,30,20983,10
9316,Warm Crab Dip II Recipe ,15,15,30,20984,12
9317,Warm Artichoke Dip Recipe ,10,15,25,20985,20
9318,Very Easy Crab Dip Recipe ,20,NULL,200,20986,28
9319,Potato Soup Recipe ,5,20,25,20987,7
9320,Fried Ice Cream Recipe ,15,2,240,20988,8
9321,Elephant Ears Recipe ,15,7,60,20989,15
9322,Key Lime Daiquiri Pound Cake Recipe ,15,90,105,20990,16
9323,Vegetable Packed Dip Recipe ,10,NULL,70,20991,32
9324,Quick Ice Cream Recipe ,10,NULL,480,20992,8
9325,Bruschetta I Recipe ,20,NULL,80,20993,4
9326,Easy Morning Glory Muffins Recipe ,25,20,45,20995,12
9327,Black Bean Soup with Rice and Sherry Recipe ,480,480,960,20996,6
9328,Haystackers Recipe ,10,25,35,20998,36
9329,Homemade Marshmallows II Recipe ,30,12,480,21000,24
9330,Chocolate Sausage (Salame di Cioccolato) Recipe ,NULL,NULL,NULL,21002,25
9331,Indian Vegetable Rice Recipe ,10,40,50,21003,2
9332,Fried Egg Sandwich Recipe ,5,10,15,21004,4
9333,Easy Banana Fritters Recipe ,5,10,15,21005,6
9334,'Mom''s Prize Winning Raw Apple Cake Recipe ',30,45,75,21007,12
9335,Roasted Vegetables Recipe ,30,90,120,21009,24
9336,Golden Penny Pancakes Recipe ,10,10,20,21011,4
9337,'Grandma''s Hash Browns Recipe ',25,60,800,21015,8
9338,Tuna Dip II Recipe ,5,NULL,5,21016,16
9339,Tuna Dip I Recipe ,7,NULL,7,21017,12
9340,Stromboli Bites Recipe ,15,45,720,21020,10
9341,Korean BBQ Chicken Marinade Recipe ,10,15,25,21033,48
9342,Marinade for Steak II Recipe ,5,NULL,185,21034,6
9343,Zucchini Casserole II Recipe ,15,25,40,21035,8
9344,Tortilla Wraps Recipe ,5,NULL,65,21036,16
9345,Broth Marinated BBQ Steak Recipe ,5,7,132,21037,2
9346,Pralines Recipe ,NULL,30,45,21038,20
9347,Tortilla Rollups I Recipe ,15,NULL,15,21040,16
9348,Tortilla Rollups II Recipe ,20,NULL,260,21041,20
9349,Tortilla Rollups III Recipe ,10,NULL,10,21042,10
9350,Tortilla Rollups V Recipe ,45,NULL,765,21043,10
9351,Whipped Sweet Potato Casserole Recipe ,10,30,40,21045,5
9352,Tennessee Rubdown Recipe ,5,NULL,485,21046,4
9353,'Squirrel''s Great Beef Steak Recipe ',10,14,744,21048,1
9354,Special Chicken Kabobs Recipe ,30,15,525,21049,4
9355,Simple Pork Rib Dry Rub Recipe ,10,NULL,10,21050,8
9356,Vegetable Beef Minestrone Recipe ,15,60,75,21051,6
9357,One Bowl Chocolate Fudge Recipe ,15,3,138,21052,48
9358,Butterscotch Fudge Recipe ,NULL,10,40,21054,24
9359,'Grandma''s Peanut Butter Fudge Recipe ',NULL,20,60,21055,24
9360,Ham and Cheese Breakfast Casserole Recipe ,30,40,555,21056,12
9361,Vegetable Bacon Chowder Recipe ,15,30,45,21057,5
9362,Bread Pudding with Whiskey Sauce and Fruit Recipe ,20,60,80,21058,14
9363,Flavorful Rice Recipe ,5,20,25,21059,8
9364,Toasted Garlic Bread Recipe ,10,5,15,21060,10
9365,Bacon and Cheddar Stuffed Mushrooms Recipe ,15,15,30,21061,8
9366,Bologna Salad Sandwich Spread I Recipe ,20,NULL,160,21062,48
9367,Mississippi Six Recipe ,30,90,120,21065,32
9368,Spaghetti Sauce Recipe ,10,20,30,21066,4
9369,Polish Mistakes Recipe ,10,10,20,21067,15
9370,Egg and Cornbread Bake Recipe ,15,45,60,21068,6
9371,Chickpea Salad Recipe ,15,NULL,15,21070,4
9372,Hearty One Pan Breakfast Recipe ,30,30,90,21071,8
9373,Ham and Braunschweiger Pate Recipe ,30,NULL,150,21072,32
9374,Fig Cake I Recipe ,30,90,120,21074,18
9375,Italian Sauce Recipe ,10,20,30,21078,16
9376,Garlic Pita Bread Bites Recipe ,15,10,25,21079,20
9377,Great Garlic Bread Recipe ,10,15,25,21080,8
9378,Fabulous Foolproof Lasagna Recipe ,15,45,60,21082,8
9379,Easy Tomato Sauce Recipe ,NULL,30,30,21083,4
9380,Jezebel Sauce Recipe ,15,NULL,495,21085,24
9381,Cucumbers with Sour Cream Recipe ,10,NULL,10,21086,4
9382,Italian Stewed Tomatoes Recipe ,30,10,40,21092,9
9383,Seasoned Cottage Cheese Recipe ,10,NULL,490,21093,32
9384,Easy Spinach Souffle Recipe ,5,20,25,21094,5
9385,Delicious Curried Manapua Puffs Recipe ,30,15,45,21095,25
9386,Chocolate Bread Pudding Recipe ,60,75,480,21096,8
9387,Sweet Corn Cakes Recipe ,15,60,75,21097,8
9388,Zucchilattas Recipe ,15,20,35,21098,10
9389,Banana Pancake Muffins Recipe ,5,15,20,21101,4
9390,Fresh Apple Cake III Recipe ,20,25,45,21107,10
9391,Oatmeal Whole Wheat Quick Bread Recipe ,20,20,40,21108,12
9392,Vegan Taco Chili Recipe ,10,60,70,21111,10
9393,Cranberry Glazed Pork Ribs Recipe ,30,60,90,21112,6
9394,Baked Cheese Sticks Recipe ,35,8,43,21113,6
9395,Vegan Split Pea Soup II Recipe ,10,45,55,21114,6
9396,Homemade Tomato Sauce I Recipe ,30,240,270,21126,6
9397,Baked Apples Recipe ,15,15,30,21127,4
9398,Shrimp Toast Rectangles Recipe ,20,15,35,21128,6
9399,Fluffy Frosting Recipe ,5,NULL,20,21129,12
9400,Caramel Apples Recipe ,8,2,25,21130,6
9401,Berry,15,25,40,21131,12
9402,Sweet Baked Apples Recipe ,10,20,30,21133,4
9403,Candied Apples II Recipe ,10,30,40,21134,15
9404,E,15,15,30,21135,12
9405,'Donna''s White Sauce Recipe ',5,10,15,21137,32
9406,Roasted Fall Vegetables Recipe ,15,60,75,21138,2
9407,Orange Johnny Cake Recipe ,5,25,30,21139,12
9408,Stuffed Pork Chops I Recipe ,20,40,60,21140,4
9409,Wild Rice Pilaf Recipe ,5,25,30,21141,5
9410,Delicious Southern Cornbread Recipe ,10,20,30,21143,8
9411,Seven Minute Frosting II Recipe ,5,7,12,21144,18
9412,Homemade Stewed Tomatoes Recipe ,20,30,50,21145,16
9413,Creamed Spinach I Recipe ,10,15,25,21146,4
9414,Garlic Jelly Recipe ,5,20,25,21147,32
9415,Double Crust Bean Pie Recipe ,10,75,85,21150,6
9416,Florida Strawberry Bread Recipe ,15,75,90,21152,24
9417,Tomato Spinach and Bean Burrito Recipe ,10,25,35,21153,4
9418,Quick and Simple Broccoli and Cheese Recipe ,5,15,20,21155,4
9419,People Chow Recipe ,15,NULL,15,21156,NULL
9420,Chickeny Chickeny Rice Recipe ,5,25,30,21157,4
9421,Blueberry Custard Recipe ,5,20,30,21159,8
9422,Cherry Roly Poly Recipe ,20,90,110,21161,6
9423,Cheese Dip I Recipe ,15,NULL,15,21163,16
9424,'Anne''s Low',40,35,75,21164,12
9425,Crispy Cucumbers and Tomatoes in Dill Dressing Recipe ,15,NULL,30,21165,6
9426,Bread and Butter Pickles II Recipe ,60,30,270,21166,50
9427,Chocolate Pretzels Recipe ,10,2,12,21169,24
9428,Hot Sauce Recipe ,30,180,210,21170,112
9429,White Sauce Recipe ,5,10,15,21171,8
9430,BBQ Pork for Sandwiches Recipe ,15,270,285,21174,12
9431,Hawaiian Sandwiches Recipe ,20,10,30,21175,8
9432,Baked Dijon Salmon Recipe ,20,15,35,21176,4
9433,Coconut Coffee Mousse Recipe ,10,NULL,240,21177,8
9434,Tomato Spinach and Basil Soup Recipe ,5,10,15,21178,4
9435,'Hungry Man''s Hash Browns Recipe ',20,25,45,21179,5
9436,Butterscotch Raisin Bread Pudding Recipe ,5,20,50,21180,8
9437,'Maria''s Broccoli Rabe Recipe ',20,20,40,21181,4
9438,Baked Salmon I Recipe ,10,40,60,21185,4
9439,Vegetable Fried Rice Recipe ,15,40,55,21186,4
9440,Stuffed Peppers My Way Recipe ,20,40,60,21190,2
9441,Funnel Cakes V Recipe ,10,30,40,21192,12
9442,Ham Breakfast Braid Recipe ,30,30,60,21196,6
9443,Easy Alfredo Sauce III Recipe ,NULL,15,15,21197,4
9444,Potatoes and Peppers Recipe ,10,20,30,21198,4
9445,Steamed Tuna Fish Recipe ,20,10,30,21201,8
9446,Ham and Cheese Breakfast Tortillas Recipe ,30,NULL,30,21202,4
9447,All,30,660,690,21205,128
9448,Reduced Fat French Toast Recipe ,5,10,15,21206,6
9449,Un,5,NULL,5,21207,4
9450,Amazing Butternut Squash Recipe ,20,40,60,21209,6
9451,Avocado Blast Recipe ,10,NULL,10,21210,4
9452,Caroling Wine Recipe ,15,15,30,21211,8
9453,Huevos Mexicanos Recipe ,20,10,30,21213,2
9454,Eggless Coffee Cake Recipe ,10,25,35,21216,6
9455,Caribbean Crab Souffle Recipe ,35,30,65,21218,8
9456,Mashed Sweet Potatoes Recipe ,15,25,55,21220,6
9457,Broccoli Coleslaw Recipe ,15,NULL,75,21224,7
9458,'Annie''s Turkey Salad Recipe ',10,10,200,21225,10
9459,Butter Fried Parsnips Recipe ,10,20,30,21227,5
9460,Apple Butter IV Recipe ,10,180,190,21228,182
9461,Apple Butter V Recipe ,30,90,120,21229,128
9462,Indonesian Pork Satay Recipe ,30,10,400,21230,4
9463,Catfish Gumbo Recipe ,20,50,70,21232,6
9464,Peppermint Schnapps Liqueur Recipe ,10,10,45,21233,16
9465,Holiday Punch I Recipe ,10,NULL,130,21234,40
9466,Lemony Grape Cooler Recipe ,5,NULL,245,21235,10
9467,'Mom''s Squash Casserole Recipe ',20,60,80,21238,6
9468,Frantic Nuts Recipe ,3,NULL,3,21239,4
9469,Iced Tea II Recipe ,10,60,70,21241,8
9470,'Deb''s Millionaire Cake Recipe ',30,30,240,21244,18
9471,Pork Chop and Cabbage Casserole Recipe ,30,90,120,21245,4
9472,Vanner Juice Recipe ,5,NULL,5,21246,16
9473,Oven Fried Potatoes II Recipe ,10,30,40,21247,2
9474,Clam Fritter Snacks Recipe ,5,5,10,21249,4
9475,Mojito Recipe ,2,NULL,2,21252,1
9476,Cocktail Sauce for Shrimp Recipe ,5,NULL,5,21254,10
9477,Silver Fish Recipe ,2,NULL,2,21255,2
9478,Hurricane I Recipe ,3,NULL,3,21258,1
9479,Pork Chops a la Slow Cooker Recipe ,15,495,510,21259,4
9480,Crab Imperial II Recipe ,15,20,35,21262,4
9481,Cranberry Chutney III Recipe ,10,5,15,21264,60
9482,Old Fashioned Chocolate Cake  Recipe ,45,30,75,21266,18
9483,'Mom''s Eggnog Recipe ',10,20,30,21267,6
9484,Crab and Pea Salad Recipe ,15,NULL,15,21268,4
9485,Rise To The Sun Recipe ,20,NULL,20,21269,4
9486,Banana Waffles Recipe ,10,30,45,21271,4
9487,'Jo''s Mountain Mush Recipe ',10,15,25,21272,6
9488,'Jack''s French Toast Recipe ',10,5,15,21273,2
9489,'Karen''s Baked Banana Stuffed French Toast Recipe ',10,10,20,21275,4
9490,Crab Cakes III Recipe ,15,30,45,21276,16
9491,Crab Stuff Recipe ,10,20,30,21278,1
9492,Pecan Rice Recipe ,5,40,45,21279,4
9493,Fried Corn with Bacon Recipe ,15,10,25,21280,6
9494,Crabmeat Bake Special Recipe ,10,25,35,21281,6
9495,Easiest Minute Shrimp Sauce Recipe ,5,10,15,21282,6
9496,Baked Sweet Potatoes with Raisins and Pecans Recipe ,10,60,70,21285,12
9497,'Charline''s Sweet Potato Casserole Recipe ',15,30,45,21289,24
9498,Leftover Ham and Vegetable Medley Recipe ,45,NULL,55,21290,4
9499,Cola Pork Chops Recipe ,10,60,70,21291,8
9500,Chicken Wings in Tomato Soup Recipe ,15,45,60,21292,6
9501,Stuffed Green Peppers Recipe ,15,65,80,21293,4
9502,Apricot Pork Chops Recipe ,5,60,65,21294,6
9503,'Birds'' Nest Pudding Recipe ',20,70,90,21296,6
9504,Tofu Mayo Recipe ,5,NULL,5,21299,10
9505,Potato Pancakes Recipe ,15,30,45,21304,15
9506,Fish in Foil Recipe ,10,20,30,21306,2
9507,Chocolate Bar Fondue Recipe ,5,15,20,21307,48
9508,'Aunt Betty''s Banana Pudding Recipe ',25,NULL,25,21310,10
9509,Fruit Dip IV Recipe ,5,NULL,5,21311,16
9510,Scrumptious Chocolate Cake Recipe ,20,40,60,21312,18
9511,Banana Pudding III Recipe ,20,NULL,40,21313,12
9512,Kielbasa and Potato Bake Recipe ,15,90,105,21314,8
9513,Make Ahead French Toast Recipe ,15,45,850,21315,8
9514,'Super Al''s Cocktail Sauce Recipe ',2,NULL,2,21318,2
9515,Chutney with Mint Recipe ,15,NULL,135,21320,28
9516,Grilled Scampi Recipe ,15,10,25,21321,4
9517,'Sara''s Special Red Potato Salad Recipe ',15,15,30,21323,6
9518,Quick and Easy Pimento Cheese Recipe ,5,NULL,5,21324,8
9519,Tuna Melts Recipe ,15,10,25,21325,8
9520,'Lots O''Veggies Sausage Spaghetti Sauce Recipe ',30,180,210,21326,10
9521,Macaroni Salad Virginia Style Recipe ,15,30,45,21328,12
9522,'Mamma Rita''s Eggs and Tomato Sauce Recipe ',5,10,15,21331,4
9523,Lobster Tails Steamed in Beer Recipe ,5,8,13,21333,2
9524,Fried Butterflied Shrimp Recipe ,25,10,35,21338,4
9525,Wieners and Beans Recipe ,15,20,35,21341,5
9526,Calico Squash Casserole Recipe ,10,40,50,21342,8
9527,Migas Recipe ,20,10,30,21343,4
