,Recipe Name,Prepare Time,Cook Time,Total Time,RecipeID,Servings
5634,Cheese Wafers Recipe ,485,20,505,14866,40
5635,Cream Cheese and Smoked Beef Recipe ,65,NULL,65,14867,7
5636,Crab Spread I Recipe ,5,NULL,5,14870,4
5637,'Tina''s Avocado Salsa Recipe ',65,NULL,65,14871,9
5638,Southwest Baked Chili Dip Recipe ,5,20,25,14872,10
5639,Garden Veggie Pizza Squares Recipe ,5,15,90,14873,24
5640,Over the Top Nachos Recipe ,5,5,10,14874,6
5641,Artichoke and Crabmeat Triangles Recipe ,15,15,30,14876,4
5642,Fruit Ball Recipe ,5,NULL,5,14878,32
5643,Original Buffalo Wings Recipe ,10,15,30,14879,24
5644,Blue Cheese Dressing Recipe ,5,NULL,65,14880,12
5645,Chicken Wraps Recipe ,245,20,270,14881,10
5646,Rouladen Rats Recipe ,10,45,55,14882,6
5647,Bavarian Style Meatballs Recipe ,5,240,245,14883,7
5648,Pickle Rollups Recipe ,10,NULL,10,14884,10
5649,Martini Recipe ,2,NULL,2,14885,1
5650,Highball Recipe ,2,NULL,2,14887,1
5651,Kamikaze Recipe ,2,NULL,2,14888,1
5652,Cape Cod Recipe ,2,NULL,2,14889,1
5653,Whiskey Sour Recipe ,2,NULL,2,14890,1
5654,Manhattan Recipe ,2,NULL,2,14891,1
5655,Cranberry Kamikaze Recipe ,2,NULL,2,14892,1
5656,Virgin Strawberry Daiquiri Recipe ,2,NULL,2,14893,1
5657,Juice Cooler Recipe ,2,NULL,2,14894,1
5658,Shirley Temple  Recipe ,2,NULL,2,14895,1
5659,Spicy Roll,10,NULL,70,14896,24
5660,Epicurean Deviled Eggs Recipe ,5,15,80,14897,12
5661,Spicy Lentil Dip Recipe ,5,25,35,14898,16
5662,Bacon,145,20,165,14899,24
5663,Prosciutto and Parmesan Pinwheels Recipe ,10,10,20,14900,8
5664,Adult Slushies Recipe ,10,NULL,1450,14901,6
5665,Brandy Cheese Dip Recipe ,5,30,35,14903,24
5666,Mock Champagne Recipe ,480,NULL,482,14904,11
5667,Southwestern Cactus Salad Recipe ,65,NULL,65,14905,8
5668,Cream Cheese Pickles Recipe ,10,NULL,480,14906,8
5669,Warm Crab Dip I Recipe ,2,15,17,14907,32
5670,Pesto Torta (Layered Spread) Recipe ,195,NULL,200,14908,8
5671,Chestnut Appetizers Recipe ,NULL,NULL,NULL,14909,15
5672,Beef and Cheese Ball Recipe ,5,NULL,5,14910,10
5673,Cheesy Taco Dip Recipe ,5,65,70,14911,9
5674,'Mike''s Taco Dip Recipe ',5,NULL,125,14912,10
5675,Sausage Rolls Recipe ,10,18,28,14913,10
5676,Spicy Rye Rounds Recipe ,10,7,17,14914,8
5677,Pineapple Cheese Ball Recipe ,5,NULL,135,14916,16
5678,Easy Crab Dip Recipe ,5,NULL,125,14918,6
5679,Pepperoni Dip I Recipe ,10,10,30,14920,8
5680,'Jen''s Nachos Recipe ',5,10,20,14921,4
5681,Mexican Cream Cheese Rollups Recipe ,5,NULL,65,14922,8
5682,Cocktail Meatballs II Recipe ,30,30,65,14923,6
5683,Maple Sausage Balls Recipe ,5,15,20,14924,36
5684,'Joanna''s Salsa Recipe ',5,NULL,125,14925,5
5685,Legion Cheese Dip Recipe ,5,NULL,125,14926,6
5686,Easy Cheese Ball II Recipe ,5,NULL,125,14927,7
5687,Kielbasa with Honey Mustard Recipe ,10,5,15,14928,5
5688,Corn Beef Ball Recipe ,5,NULL,125,14929,6
5689,Florentine Artichoke Dip Recipe ,10,25,35,14930,16
5690,Water Chestnuts a la Bacon Recipe ,10,8,18,14931,6
5691,Cranberry Rum Punch Recipe ,5,NULL,5,14932,8
5692,"Good, Good Greenbeans Recipe ",5,NULL,485,14933,7
5693,Spiced Rum Cream Recipe ,5,NULL,5,14934,20
5694,Spicy Shrimp Dip Recipe ,5,NULL,5,14935,16
5695,Duke Recipe ,5,NULL,125,14937,5
5696,Brown Sugar Smokies Recipe ,10,20,30,14939,12
5697,Hot Jezebel Recipe ,485,NULL,490,14940,12
5698,Garlic Parmesan Olives Recipe ,5,NULL,65,14941,7
5699,BBQ Meatballs Recipe ,2,240,242,14942,7
5700,Beefy Cheese Dip Recipe ,5,10,30,14943,72
5701,BLT Dip Recipe ,5,10,25,14944,16
5702,Spinach Roll,10,NULL,75,14945,20
5703,New Orleans Hurricane Recipe ,2,NULL,2,14946,1
5704,'Rise ''n Shine Juice Recipe ',2,NULL,2,14947,12
5705,Tomato Bacon Squares Recipe ,20,20,40,14948,24
5706,Tuna Mousse Recipe ,20,NULL,500,14949,20
5707,Caramel Snack Mix Recipe ,10,60,70,14950,20
5708,Grecian Pork Tenderloin Recipe ,15,30,165,14951,6
5709,'Ally''s Chocolate Chip Cookies Recipe ',NULL,NULL,NULL,14952,12
5710,'All That''s Good Cookies Recipe ',NULL,NULL,NULL,14953,18
5711,Ragu Bologna Pasta Sauce Recipe ,NULL,NULL,NULL,14954,5
5712,Veggie Oven Chicken Recipe ,15,60,75,14956,6
5713,'Meaty ''Cuban Black Bean'' Soup Recipe ',15,45,480,14957,5
5714,Fish Supreme Recipe ,10,20,30,14958,2
5715,'Giacomina''s Authentic Pasta Asciutta Recipe ',20,20,40,14960,NULL
5716,Party Pinwheels Recipe ,10,5,140,14961,15
5717,Apple Pie III Recipe ,30,60,90,14962,8
5718,Basil and Sun,NULL,NULL,NULL,14964,12
5719,Cheese Blintzes Recipe ,20,10,30,14966,9
5720,Bacon Wrapped Water Chestnuts III Recipe ,40,NULL,75,14968,9
5721,Delicious Moist Poppy Seed Cake Recipe ,NULL,NULL,NULL,14969,12
5722,Chicago Dip Recipe ,15,NULL,20,14972,10
5723,Apple Pie Yeast Bread Recipe ,10,180,190,14973,12
5724,Butter Rum Cream Pie Recipe ,NULL,NULL,NULL,14974,8
5725,Caribbean Fudge Pie IV Recipe ,NULL,NULL,NULL,14975,8
5726,Hard Chocolate Glaze Recipe ,NULL,NULL,NULL,14976,12
5727,Cheesecake Cupcakes Recipe ,NULL,NULL,NULL,14977,18
5728,Apple Dip Recipe ,5,NULL,5,14978,8
5729,Cheese Ball with Cream Cheese Recipe ,5,NULL,125,14980,10
5730,Chili Cheese Log Recipe ,5,NULL,125,14981,7
5731,Apple and Feta Pan Fried Pizzas Recipe ,32,NULL,35,14982,8
5732,Curried Chicken with Rice Recipe ,NULL,NULL,NULL,14983,4
5733,Amazing Apple Cake Recipe ,30,45,75,14984,12
5734,'It''s Chili by George!! Recipe ',10,105,115,14985,10
5735,Country Soup in a Jar Recipe ,NULL,NULL,NULL,14989,4
5736,Hearty Lentil Soup II Recipe ,NULL,NULL,NULL,14990,2
5737,Lentil Soup II Recipe ,NULL,NULL,NULL,14991,6
5738,'Adam''s Dirt Cookies Recipe ',10,20,90,14992,48
5739,Vermont Apple Pie Recipe ,25,55,80,14993,8
5740,Christmas Turtles® Candies Recipe ,NULL,NULL,NULL,14996,12
5741,Country House Fudge Recipe ,5,10,15,14997,117
5742,Oatmeal Raisin Cookies VI Recipe ,NULL,NULL,NULL,14998,24
5743,Crushed Pineapple Sour Cream Pie Recipe ,15,NULL,75,14999,8
5744,Sweet and Spicy Baked Chicken Recipe ,NULL,NULL,NULL,15001,6
5745,Banana Oatmeal Cookies I Recipe ,5,10,15,15002,24
5746,Oven Fried Parmesan Chicken Recipe ,15,75,90,15003,6
5747,Award Winning Soft Chocolate Chip Cookies Recipe ,15,12,100,15004,72
5748,Spiced Sweet Roasted Red Pepper Hummus Recipe ,15,NULL,75,15006,8
5749,Jerk Seasoning Recipe ,10,NULL,10,15007,1
5750,Easy Biscotti ,NULL,NULL,NULL,15008,12
5751,Sour Cream Chicken and Stuffing Recipe ,NULL,NULL,NULL,15009,6
5752,Blue Cheese Bites Recipe ,10,10,20,15010,10
5753,Christmas Couscous Recipe ,NULL,NULL,NULL,15011,4
5754,Bacon Roll Ups I Recipe ,25,10,35,15014,25
5755,Brie Cheese Appetizer Recipe ,10,30,40,15015,8
5756,Pecan Cups Recipe ,NULL,NULL,NULL,15016,18
5757,Mini Ham And Cheese Rolls Recipe ,15,20,35,15018,24
5758,Salsa Cheese Boule Dip Recipe ,5,90,95,15019,9
5759,Chip Dip Recipe ,5,NULL,5,15020,4
5760,Veggie Pizza Recipe ,25,NULL,145,15022,16
5761,Roasted Italian Herb Chicken Recipe ,NULL,NULL,NULL,15024,4
5762,Creamy Potato Casserole Recipe ,NULL,NULL,NULL,15025,8
5763,Salsa Chicken and Potato Packets Recipe ,NULL,NULL,NULL,15026,4
5764,Overnight Raisin Oatmeal Pancakes Recipe ,20,10,750,15027,9
5765,Chicken and Broccoli Braid Recipe ,20,28,48,15028,6
5766,'Angela''s Easy Breaded Chicken Recipe ',NULL,NULL,NULL,15030,4
5767,Country Pie Recipe ,NULL,NULL,NULL,15033,6
5768,Mandarin Almond Salad Recipe ,20,10,40,15034,8
5769,Chicken Tetrazzini for a Crowd Recipe ,NULL,NULL,NULL,15036,20
5770,Low Sugar Oatmeal Raisin Cookie Recipe ,NULL,NULL,NULL,15038,12
5771,Swedish Jam Cookies Recipe ,NULL,NULL,NULL,15039,12
5772,Chickpea Soup II Recipe ,NULL,NULL,NULL,15040,4
5773,Chocolate Caramel Nut Cheesecake Recipe ,NULL,NULL,NULL,15041,12
5774,Ambrosial Bread Recipe ,NULL,NULL,NULL,15042,15
5775,Chicken Tortilla Soup IV Recipe ,NULL,NULL,NULL,15043,6
5776,Spruced Up Mashed Potatoes Recipe ,NULL,NULL,NULL,15044,10
5777,Wednesday Cookies Recipe ,NULL,NULL,NULL,15045,60
5778,Easy Peach Cobbler Recipe ,NULL,NULL,NULL,15046,12
5779,Florida Key Lime Pie Recipe ,NULL,NULL,NULL,15049,8
5780,Quick and Easy Fruit Dip Recipe ,5,NULL,65,15050,25
5781,Baked Omelet Recipe ,15,40,55,15051,4
5782,Cream Cheese Bread Recipe ,NULL,NULL,NULL,15052,12
5783,Seafood Newburg Recipe ,5,10,15,15053,4
5784,Fruit Bread III Recipe ,NULL,NULL,NULL,15054,15
5785,Chili Cheese Dip I Recipe ,2,20,22,15055,96
5786,Overnight Blueberry French Toast Recipe ,15,75,600,15057,10
5787,Spicy Red Bean Soup Recipe ,NULL,NULL,NULL,15061,20
5788,Pudding from Scratch Recipe ,NULL,NULL,NULL,15062,4
5789,Savory Chicken Breasts Recipe ,NULL,NULL,NULL,15063,4
5790,Almond Bars I Recipe ,NULL,NULL,NULL,15065,12
5791,'World''s Greatest Chewy Chocolate Chip Cookies Recipe ',NULL,NULL,NULL,15066,6
5792,Eggplant Tomato Bake Recipe ,NULL,NULL,NULL,15068,4
5793,Fast Apple Rhubarb Pie Recipe ,NULL,NULL,NULL,15069,8
5794,White Chili II Recipe ,NULL,NULL,NULL,15070,6
5795,Royal Hawaiian Pie Recipe ,NULL,NULL,NULL,15071,8
5796,No Crust Strawberry Pie Recipe ,NULL,NULL,NULL,15072,8
5797,Chocolate Chip Banana Muffins Recipe ,NULL,NULL,NULL,15073,12
5798,French Pastry Pie Crust Recipe ,NULL,NULL,NULL,15075,16
5799,Rocky Road Fudge Bars Recipe ,NULL,NULL,NULL,15079,24
5800,Mushroom Cheese Puffs Recipe ,10,10,20,15080,8
5801,Quick and Easy Chili Dip Recipe ,5,30,35,15081,6
5802,'Aunt Shirley''s Dietetic Pie Recipe ',NULL,NULL,NULL,15082,8
5803,Best Apple Pie Recipe ,NULL,NULL,NULL,15083,8
5804,Vegetarian Chili Recipe ,10,60,70,15084,6
5805,Chocolate Cereal Puffs Recipe ,NULL,NULL,NULL,15086,18
5806,Broiled Pork Chops Recipe ,20,15,35,15089,6
5807,Coconut Cream Pie VII Recipe ,NULL,NULL,NULL,15090,8
5808,Chocolate Peanut Butter Bars III Recipe ,NULL,NULL,NULL,15091,12
5809,Chocolate Peanut Butter Bars IV Recipe ,NULL,NULL,NULL,15092,24
5810,'Grandma''s Lemon Meringue Pie Recipe ',30,10,40,15093,8
5811,Beef and Barley Soup III Recipe ,NULL,NULL,NULL,15094,12
5812,Coffee Liqueur Brownies Recipe ,NULL,NULL,NULL,15095,12
5813,Hamburger Soup V Recipe ,NULL,NULL,NULL,15096,10
5814,Date Filled Cookie Bars Recipe ,NULL,NULL,NULL,15098,24
5815,Hamburger Pie I Recipe ,NULL,NULL,NULL,15100,8
5816,'Shepherd''s Pie Complete Recipe ',NULL,NULL,NULL,15102,6
5817,Tamale Pie Casserole Recipe ,NULL,NULL,NULL,15103,8
5818,Gooey Chocolate Carmel Bars Recipe ,NULL,NULL,NULL,15104,60
5819,Granola Bars II Recipe ,NULL,NULL,NULL,15105,24
5820,Broccoli Crawfish Cheese Soup Recipe ,NULL,NULL,NULL,15106,12
5821,Cajun Style Corn Soup Recipe ,NULL,NULL,NULL,15107,4
5822,Cajun Style Red Bean and Rice Soup Recipe ,NULL,NULL,NULL,15108,6
5823,Slow Cooker Spaghetti Sauce I Recipe ,10,240,250,15109,10
5824,Lemon Bars II Recipe ,NULL,NULL,NULL,15110,30
5825,Lemon Dream Bars Recipe ,NULL,NULL,NULL,15111,12
5826,Broccoli Cheese Soup V Recipe ,NULL,NULL,NULL,15113,6
5827,Marble Squares I Recipe ,NULL,NULL,NULL,15114,30
5828,Marie Edwards Cookies Recipe ,NULL,NULL,NULL,15115,18
5829,Cheese Soup III Recipe ,NULL,NULL,NULL,15116,6
5830,Cheese Soup IV Recipe ,NULL,NULL,NULL,15117,7
5831,Cheese Soup with Broccoli Recipe ,NULL,NULL,NULL,15118,7
5832,Cheese Vegetable Soup II Recipe ,NULL,NULL,NULL,15119,20
5833,Quick Cheeseburger Pie Recipe ,20,30,50,15120,8
5834,No Bake Double Good Dessert Recipe ,NULL,NULL,NULL,15121,36
5835,Cheesy Vegetable Soup II Recipe ,10,50,60,15122,7
5836,Peanut Butter Fudge III Recipe ,5,10,50,15124,24
5837,Peanut Butter Fudge IV Recipe ,NULL,NULL,NULL,15125,24
5838,Pecan Bars II Recipe ,NULL,NULL,NULL,15126,36
5839,Captain Crunch Chicken Recipe ,NULL,NULL,NULL,15128,4
5840,'Petey''s Squares Recipe ',NULL,NULL,NULL,15129,30
5841,Zinfandel Vinaigrette Recipe ,15,NULL,815,15130,8
5842,Creamy Shrimp and Corn Soup Recipe ,NULL,NULL,NULL,15131,8
5843,Sour Cream Mushroom Chicken Recipe ,NULL,NULL,NULL,15132,6
5844,'Kelly''s Chicken and Ziti Recipe ',NULL,NULL,NULL,15133,6
5845,Mushroom Chicken Piccata Recipe ,20,30,50,15134,6
5846,'Grampy''s Special Bread Recipe ',NULL,NULL,NULL,15137,12
5847,Apple Pecan Cobbler Recipe ,30,55,85,15138,8
5848,Cherry Cobbler II Recipe ,NULL,NULL,NULL,15139,12
5849,Luscious Spinach Artichoke Dip Recipe ,10,25,35,15141,24
5850,Award Winning Peaches and Cream Pie Recipe ,30,40,210,15142,8
5851,Best Burritos Recipe ,NULL,NULL,NULL,15143,1
5852,Angel Whispers Recipe ,10,8,30,15144,24
5853,Cream Tea Cakes Recipe ,30,10,40,15145,9
5854,Mushroom and Leek Soup Recipe ,15,35,50,15146,6
5855,Trifle Pudding Recipe ,NULL,NULL,NULL,15147,16
5856,Fresh Peach Cobbler I Recipe ,30,25,55,15148,6
5857,Sugar Cookie Cutouts Recipe ,NULL,NULL,NULL,15149,36
5858,Authentic Arawak Bar,15,NULL,75,15150,2
5859,Coconut Cream Pie VI Recipe ,NULL,NULL,NULL,15151,8
5860,Whole Wheat Bread III Recipe ,NULL,NULL,NULL,15152,12
5861,Snickerdoodle Supreme Recipe ,NULL,NULL,NULL,15153,24
5862,CheckerBoard Cookies II Recipe ,NULL,NULL,NULL,15154,12
5863,'Becca''s Taco Soup Recipe ',NULL,NULL,NULL,15155,8
5864,Easy Chicken Curry Recipe ,15,60,75,15156,6
5865,Mizithra Browned Butter Pasta Recipe ,10,15,25,15157,8
5866,Creamy Chicken and Rice Soup Recipe ,NULL,NULL,NULL,15158,8
5867,Party Potatoes Recipe ,10,45,55,15159,8
5868,Fruit and Cream Phyllo Pie Recipe ,NULL,NULL,NULL,15160,8
5869,Cowboy Cookie Mix in a Jar Recipe ,25,NULL,25,15161,18
5870,Carrot Walnut Cake Recipe ,30,60,90,15162,16
5871,Pecan Tarts Recipe ,NULL,NULL,NULL,15163,8
5872,Ranch Bean Dip Recipe ,2,10,12,15164,8
5873,Easy Cheesy Bacon Potato Soup Recipe ,NULL,NULL,NULL,15165,3
5874,Easy Tortilla Soup Recipe ,NULL,NULL,NULL,15166,2
5875,Broccoli Cheddar Pie  Recipe ,NULL,NULL,NULL,15167,8
5876,Vintage Cheese And Crabmeat Soup Recipe ,NULL,NULL,NULL,15168,4
5877,Broccoli Potato Soup Recipe ,NULL,NULL,NULL,15169,4
5878,Cream of Broccoli Soup IV Recipe ,15,20,35,15170,8
5879,Lemon Meringue Pie III Recipe ,NULL,NULL,NULL,15173,8
5880,No Fail Pie Crust I Recipe ,NULL,NULL,NULL,15174,24
5881,Easy a la King Recipe ,NULL,NULL,NULL,15175,4
5882,'Nanny''s Spaghetti Sauce Recipe ',NULL,NULL,NULL,15176,6
5883,Famous Japanese Restaurant,10,NULL,10,15177,14
5884,Golden Sultana Bread Recipe ,5,180,185,15178,6
5885,Hearty Vegetable Soup Recipe ,NULL,NULL,NULL,15179,7
5886,Cranberry Oatmeal Drops Recipe ,NULL,NULL,NULL,15180,14
5887,Famous Chicken Francaise Recipe ,20,25,45,15181,6
5888,Vegetarian Carrot Cake Recipe ,NULL,NULL,NULL,15182,10
5889,Mouth,25,20,45,15184,12
5890,Better Butter Cookies Recipe ,NULL,NULL,NULL,15185,48
5891,Cannoli II Recipe ,10,30,50,15186,24
5892,Country Style Chicken Recipe ,NULL,NULL,NULL,15187,4
5893,Cathedral Windows II Recipe ,NULL,NULL,NULL,15188,12
5894,Au Gratin Potatoes II Recipe ,15,65,80,15190,6
5895,Chocolate Peanut Butter Pie V Recipe ,NULL,NULL,NULL,15191,8
5896,Baked Brie in Puff Pastry Recipe ,5,20,25,15192,8
5897,Solid Gold Pie Recipe ,NULL,NULL,NULL,15193,8
5898,Easy Elegant Skillet Chicken Supreme Recipe ,5,25,30,15194,4
5899,Cat Poop Cookies II Recipe ,NULL,NULL,NULL,15195,18
5900,Oven Baked Herb Chicken Recipe ,NULL,NULL,NULL,15199,6
5901,Wine Cheese Fondue Recipe ,10,20,30,15200,8
5902,Vegetable Dip Recipe ,5,NULL,245,15202,12
5903,'Crab ''N Shrimp Dip Recipe ',NULL,NULL,NULL,15205,18
5904,Cocktail Meatballs Recipe ,20,85,105,15206,10
5905,Savory Diet Chicken Recipe ,NULL,NULL,NULL,15207,4
5906,Fresh Rosemary Bread Recipe ,5,180,185,15208,12
5907,Cake in a Mug Recipe ,NULL,NULL,NULL,15209,8
5908,Easy Marinated Vegetables Recipe ,NULL,NULL,NULL,15211,4
5909,Easy Corn Chowder I Recipe ,NULL,NULL,NULL,15212,3
5910,Crab Bites Recipe ,10,NULL,130,15214,7
5911,Cheese Puff Appetizers Recipe ,15,15,30,15215,12
5912,Crispy Crunchy Chicken Strips Recipe ,20,20,40,15216,4
5913,Beau Monde  Dip Recipe ,10,NULL,70,15217,12
5914,Strawberry Oatmeal Cream Cheese Bread Recipe ,NULL,NULL,NULL,15219,10
5915,Mystery Prize Chicken Recipe ,NULL,NULL,NULL,15220,8
5916,Meat Filled Manicotti Recipe ,20,50,70,15222,6
5917,Anzac Biscuits with Macadamia Nuts Recipe ,NULL,NULL,NULL,15223,30
5918,Tropical Chicken I Recipe ,NULL,NULL,NULL,15224,10
5919,Lasagna Alfredo Roll Ups Recipe ,NULL,NULL,NULL,15225,8
5920,Oatmeal Toffee Cookies Recipe ,NULL,NULL,NULL,15226,36
5921,Peanut Butter Banana Oatmeal Raisin Recipe ,10,17,45,15227,18
5922,Banana Pie Recipe ,NULL,NULL,NULL,15228,10
5923,Thighs on Rice Recipe ,NULL,NULL,NULL,15229,6
5924,Mock Caviar Recipe ,5,NULL,485,15230,20
5925,Pumpkin Squares Recipe ,NULL,NULL,NULL,15236,24
5926,Raisin Peanut Bars Recipe ,NULL,NULL,NULL,15237,24
5927,Delicious Baked Chicken Recipe ,NULL,NULL,NULL,15238,4
5928,Pumpkin Custard Pie I Recipe ,NULL,NULL,NULL,15239,8
5929,Sesame Bars Recipe ,NULL,NULL,NULL,15240,16
5930,Shortbread Cookies IV Recipe ,NULL,NULL,NULL,15241,24
5931,Sunburst Lemon Bars Recipe ,NULL,NULL,NULL,15243,NULL
5932,Pastini Soup Recipe ,5,10,15,15245,4
5933,Yummy Fruit Pizza Recipe ,NULL,NULL,NULL,15246,12
5934,Bon Bon Christmas Cookies Recipe ,NULL,NULL,NULL,15247,24
5935,Cathedral Windows I Recipe ,NULL,NULL,NULL,15248,30
5936,'Cathy''s Peanut Butter Fudge Recipe ',25,NULL,25,15249,12
5937,Apricot/Cranberry Chutney Recipe ,10,15,30,15250,12
5938,Chocolate Chip Meringue  Recipe ,NULL,NULL,NULL,15251,24
5939,Sesame Anise Melts Recipe ,NULL,NULL,NULL,15252,18
5940,Chocolate Walnut Rum Balls Recipe ,NULL,NULL,NULL,15254,45
5941,Christmas Orange Balls Recipe ,NULL,NULL,NULL,15255,6
5942,"Chicken, Rice and Vegetable Soup Recipe ",20,30,50,15257,4
5943,Coconut Bon Bons Recipe ,30,5,125,15258,36
5944,Cookie in a Jar Recipe ,20,NULL,20,15259,12
5945,'Colene''s Easy Tomato Vegetable Soup Recipe ',NULL,NULL,NULL,15260,4
5946,Country Oatmeal Cookie in a Jar Recipe ,15,15,30,15261,12
5947,Cranberry Hootycreeks Recipe ,25,NULL,25,15262,18
5948,'Devil''s Food Peanut Butter Chip Cookies Recipe ',10,12,45,15263,30
5949,Easy to Make Ginger Cookies Recipe ,NULL,NULL,NULL,15264,12
5950,Fluffy White Frosting Recipe ,NULL,NULL,NULL,15265,12
5951,Grilled Chicken Cordon Bleu Sandwiches Recipe ,5,5,10,15266,1
5952,Four Spice Crackles Recipe ,NULL,NULL,NULL,15267,24
5953,Fruit Meringues Recipe ,NULL,NULL,NULL,15270,18
5954,German Anise Christmas Cookies (Springerle) Recipe ,NULL,NULL,NULL,15271,36
5955,Caldo De Res (Beef Soup) Recipe ,NULL,NULL,NULL,15273,4
5956,'Great Grandad''s Sugar Cookies Recipe ',30,10,70,15274,30
5957,Gumdrop Cookies I Recipe ,NULL,NULL,NULL,15275,18
5958,Kolaczki Recipe ,NULL,NULL,NULL,15277,24
5959,Kourambiathes (Greek Cookies) Recipe ,30,15,45,15278,16
5960,Cream of Asparagus Soup II Recipe ,NULL,NULL,NULL,15279,8
5961,Potato Soup a la Inge Recipe ,NULL,NULL,NULL,15280,4
5962,Orange Cranberry Biscotti Recipe ,NULL,NULL,NULL,15282,20
5963,White BBQ Sauce Recipe ,NULL,NULL,NULL,15284,24
5964,Pattern Cookies Recipe ,NULL,NULL,NULL,15285,12
5965,Margarita Balls II Recipe ,NULL,NULL,NULL,15286,48
5966,Pfeffernusse Kuchen Recipe ,NULL,NULL,NULL,15287,50
5967,Pizzelle,NULL,NULL,NULL,15289,6
5968,Russian Rocks II Recipe ,NULL,NULL,NULL,15291,60
5969,Snow Balls in a Jar Recipe ,NULL,NULL,NULL,15292,24
5970,Soft Gingerbread Cookies Recipe ,25,10,225,15293,36
5971,Acini di Pepe Salad Recipe ,NULL,NULL,NULL,15294,8
5972,Soft Sugar Cookies IV Recipe ,NULL,NULL,NULL,15295,24
5973,Sour Cream Cut,NULL,NULL,NULL,15296,18
5974,Special Butterscotch Chip Cookies in a Jar Recipe ,NULL,NULL,NULL,15297,12
5975,Tea Cakes III Recipe ,NULL,NULL,NULL,15299,48
5976,'Tina''s Shortbread Chocolate Chip Cookies Recipe ',NULL,NULL,NULL,15300,12
5977,'Vel''s Christmas Shortbread Recipe ',30,12,60,15301,60
5978,Southwest Chicken Recipe ,NULL,NULL,NULL,15302,4
5979,Coconut Cake IV Recipe ,30,60,90,15303,12
5980,Black Walnut Cookies II Recipe ,NULL,NULL,NULL,15304,36
5981,Butterscotch Oatmeal Cookies II Recipe ,NULL,NULL,NULL,15308,30
5982,Butterscotch Pecan Cookies Recipe ,NULL,NULL,NULL,15309,18
5983,Chewy Gooey Cookies Recipe ,NULL,NULL,NULL,15312,18
5984,Chocolate Espresso Cookies Recipe ,NULL,NULL,NULL,15313,18
5985,Chocolate Rocky Road Cookies Recipe ,NULL,NULL,NULL,15314,24
5986,Chocolate Swirl and Chip Cookies Recipe ,NULL,NULL,NULL,15315,18
5987,Cracker Jack Cookies I Recipe ,NULL,NULL,NULL,15316,36
5988,Fabulous Chocolate Chip Cookies Recipe ,NULL,NULL,NULL,15318,18
5989,Filled Date Cookies Recipe ,NULL,NULL,NULL,15320,30
5990,Fruit Cocktail Drop Cookies Recipe ,NULL,NULL,NULL,15322,36
5991,German Rocks Recipe ,15,10,25,15323,36
5992,Ginger,NULL,NULL,NULL,15324,12
5993,'Grandma Strojny''s Mud Cookies Recipe ',20,10,30,15326,12
5994,Capirotada (Mexican Bread Pudding) Recipe ,30,30,75,15327,10
5995,'Helen''s Raisin Drop Cookies Recipe ',NULL,NULL,NULL,15329,24
5996,'Jack''s Chocolate Chip Cookies Recipe ',NULL,NULL,NULL,15330,36
5997,Jacksonville Crisps Recipe ,NULL,NULL,NULL,15331,15
5998,Jailhouse Rocks  Recipe ,15,11,26,15332,18
5999,'Kori''s Whole Wheat Cookies Recipe ',NULL,NULL,NULL,15333,18
6000,'Kristen''s Awesome Oatmeal Cookies Recipe ',NULL,NULL,NULL,15334,30
6001,Individual Beef Wellingtons Recipe ,20,25,45,15336,6
6002,Bimini Bread Recipe ,NULL,NULL,NULL,15337,10
6003,Old Fashioned Chicken and Dumplings Recipe ,NULL,NULL,NULL,15338,20
6004,Mexican Layered Dip Recipe ,10,NULL,130,15340,10
6005,French Onion Soup IV Recipe ,NULL,NULL,NULL,15341,6
6006,Guadalajara Soup Recipe ,NULL,NULL,NULL,15342,10
6007,Menudo Recipe ,NULL,NULL,NULL,15343,7
6008,Chicken Vegetable Soup Recipe ,NULL,NULL,NULL,15344,10
6009,Christmas Bread Pudding Recipe ,NULL,NULL,NULL,15345,6
6010,'Jean''s Homemade Chicken Noodle Soup Recipe ',20,25,45,15346,4
6011,Caramel Shortbread Squares Recipe ,10,25,35,15347,40
6012,"Bean, Bacon and Pepper Soup Recipe ",NULL,NULL,NULL,15348,5
6013,Veggie Chicken Rice Casserole Recipe ,NULL,NULL,NULL,15351,6
6014,Coconut Walnut Biscotti Recipe ,NULL,NULL,NULL,15353,18
6015,Slow Cooker Corn Chowder Recipe ,20,510,530,15355,9
6016,"Bratwurst, Potato and Cabbage Soup Recipe ",NULL,NULL,NULL,15356,8
6017,Caramel Corn Snack Mix Recipe ,25,30,55,15357,15
6018,'Michelle''s Roast Chicken Recipe ',NULL,NULL,NULL,15358,6
6019,Spicy Tortilla Roll,70,NULL,75,15359,30
6020,Soy Sauce Chicken and Rice Recipe ,NULL,NULL,NULL,15360,4
6021,Avocado Pie Recipe ,NULL,NULL,NULL,15362,8
6022,Creamy Mexican Dip Recipe ,5,NULL,125,15363,8
6023,'Shepherd''s Pie III Recipe ',NULL,NULL,NULL,15364,6
6024,Boiling Water Crust II Recipe ,NULL,NULL,NULL,15365,8
6025,Date and Nut Bread Recipe ,NULL,NULL,NULL,15366,12
6026,'Martha''s Vegetable Beef Soup Recipe ',5,25,30,15367,6
6027,Carrot Spice and Walnut Pie Recipe ,30,60,90,15369,10
6028,Lemon Meringue Pie II Recipe ,NULL,NULL,NULL,15371,8
6029,Cheese Dipping Sauce Recipe ,2,10,12,15372,4
6030,Best Ever Blueberry Cobbler Recipe ,20,40,60,15373,6
6031,Chocolate Meringue Pie Recipe ,NULL,NULL,NULL,15374,8
6032,Fried Chicken with Creamy Gravy Recipe ,25,30,55,15375,8
6033,Italian Teething Cookies Recipe ,NULL,NULL,NULL,15376,12
6034,'Cheater''s Enchiladas Recipe ',10,20,30,15378,8
6035,'Tanya''s Snickerdoodles Recipe ',NULL,NULL,NULL,15379,25
6036,Crabmeat Toasts Recipe ,5,8,15,15380,6
6037,Black Walnut Cookies Recipe ,NULL,NULL,NULL,15381,48
6038,"Hearty Potato, Bacon and Onion Soup Recipe ",NULL,NULL,NULL,15384,4
6039,Orange Bread Recipe ,NULL,NULL,NULL,15385,15
6040,Chili III Recipe ,NULL,NULL,NULL,15386,7
6041,Lactose Free Corn Chowder Recipe ,NULL,NULL,NULL,15387,8
6042,Potato Soup VIII Recipe ,NULL,NULL,NULL,15388,5
6043,Red Potato Soup Recipe ,NULL,NULL,NULL,15389,16
6044,Easy Vegetable Soup I Recipe ,NULL,NULL,NULL,15390,8
6045,One Bowl Chocolate Cake I Recipe ,NULL,NULL,NULL,15391,24
6046,Wellesley Fudge Cake I Recipe ,NULL,NULL,NULL,15392,24
6047,Pasta Chicken and Sun,NULL,NULL,NULL,15394,8
6048,Incredible Chicken Recipe ,NULL,NULL,NULL,15395,8
6049,'C and L''s Stuffed Black Olives Recipe ',25,10,35,15396,8
6050,Herb Bread Recipe ,NULL,NULL,NULL,15397,12
6051,Italian Ties Recipe ,NULL,NULL,NULL,15398,18
6052,Cinnamon Coffee Cake II Recipe ,NULL,NULL,NULL,15399,24
6053,Caramel Pie Recipe ,NULL,NULL,NULL,15400,10
6054,Easy Chili I Recipe ,NULL,NULL,NULL,15401,6
6055,Hearty Oatmeal Loaf Recipe ,NULL,NULL,NULL,15402,12
6056,Sugarless Pumpkin Pie II Recipe ,NULL,NULL,NULL,15403,8
6057,Carrot Pineapple Cake III Recipe ,NULL,NULL,NULL,15405,20
6058,Honey Baked Chicken I Recipe ,NULL,NULL,NULL,15406,5
6059,Pasta Milan Recipe ,20,15,35,15408,2
6060,Steak Chili Recipe ,NULL,NULL,NULL,15410,6
6061,Homemade Irish Cream Recipe ,495,NULL,500,15411,24
6062,Rosemary Sherry Pork Chops Recipe ,10,25,35,15412,4
6063,Roasted Red Bell Pepper Soup Recipe ,NULL,NULL,NULL,15413,6
6064,Amaretto Mousse Cheesecake Recipe ,5,10,735,15414,12
6065,Toasted Coconut Cream Pie Recipe ,35,35,1510,15415,8
6066,Vegan Crepes Recipe ,5,20,145,15417,4
6067,Strawberry Slush Recipe ,10,NULL,490,15418,6
6068,Fruit Dip I Recipe ,5,NULL,5,15420,5
6069,Alaskan Snow Pie Recipe ,30,15,45,15421,8
6070,Pierogi II Recipe ,20,10,30,15422,12
6071,Blueberry Delight Recipe ,NULL,NULL,NULL,15423,8
6072,Cheesecake Topped Brownies Recipe ,20,45,65,15424,40
6073,Cranapana Bread Recipe ,25,60,85,15426,12
6074,Roast Chicken with Rosemary Recipe ,10,120,130,15427,6
6075,Farfalle with Asparagus and Smoked Salmon Recipe ,10,20,150,15428,4
6076,Steak n Ale Pie Recipe ,NULL,NULL,NULL,15429,4
6077,Zucchini Soup III Recipe ,NULL,NULL,NULL,15430,16
6078,Beef and Vegetable Stew Recipe ,15,145,160,15431,6
6079,Angel Food Cake III Recipe ,30,45,75,15432,14
6080,Angel Food Cake with Toasted Almonds Recipe ,30,35,125,15433,12
6081,Celery and Stilton Soup Recipe ,20,40,60,15435,4
6082,Texas Brazil Nut Fruitcake Recipe ,NULL,NULL,NULL,15437,36
6083,Chocolate Crunch Pie Recipe ,NULL,NULL,NULL,15438,8
6084,Peach Cobbler IV Recipe ,NULL,NULL,NULL,15441,6
6085,Peach Cobbler V Recipe ,NULL,NULL,NULL,15442,8
6086,'Lyn''s Chicken Recipe ',10,40,50,15444,4
6087,Stuffed Mushrooms I Recipe ,20,20,40,15445,9
6088,Garlic Cheese Chicken Rollups Recipe ,NULL,NULL,NULL,15448,4
6089,Swedish Meatballs I Recipe ,25,60,85,15449,4
6090,Chocolate Covered Caramel Surprise Cookies Recipe ,NULL,NULL,NULL,15450,18
6091,Southern Butternut Squash Recipe ,20,30,50,15451,5
6092,Marble Nut Clusters Recipe ,NULL,NULL,NULL,15453,12
6093,Easy Pizza Sauce II Recipe ,NULL,NULL,NULL,15454,16
6094,Pineapple Walnut Salad Recipe ,5,NULL,35,15455,2
6095,Navy Bean Pie Recipe ,NULL,NULL,NULL,15457,8
6096,Sweet Potato Pie VI Recipe ,NULL,NULL,NULL,15458,8
