,Recipe Name,Prepare Time,Cook Time,Total Time,RecipeID,Servings
0,Golden Crescent Rolls Recipe ,25,15,190,7000,20
1,Poppy Seed Bread with Glaze Recipe ,15,60,80,7001,24
2,Applesauce Bread I Recipe ,10,80,90,7003,24
3,Apple Raisin Bread Recipe ,15,60,75,7006,12
4,Buttermilk Oatmeal Bread Recipe ,10,60,100,7007,12
5,Kolaches II Recipe ,30,20,125,7008,36
6,Whole Wheat Bread II Recipe ,20,35,145,7009,48
7,Cottage Cheese Bread II Recipe ,5,180,185,7012,12
8,Mocha Chocolate Chip Banana Muffins Recipe ,10,25,35,7013,18
9,'Ruby''s Special Cornbread Recipe ',10,45,55,7014,8
10,Maple Muffins Recipe ,10,20,30,7015,12
11,French Toast I Recipe ,5,15,20,7016,3
12,Angel Biscuits II Recipe ,35,10,105,7018,24
13,Fudgy Chocolate Chip Muffins Recipe ,10,25,35,7019,12
14,Pumpernickel Bread II Recipe ,30,60,150,7020,15
15,Indian Naan II Recipe ,25,20,145,7021,6
16,Lefse II Recipe ,15,45,60,7022,12
17,Banana Nut Bread Baked in a Jar Recipe ,10,45,65,7024,24
18,Light Oat Bread Recipe ,5,180,185,7025,12
19,Honey Oatmeal Bread I Recipe ,5,180,185,7026,10
20,Oatmeal Soda Bread Recipe ,10,40,50,7030,12
21,'Mary Anne''s Moist and Nutty Carrot Loaf Recipe ',15,45,60,7033,24
22,Russian Black Bread Recipe ,15,180,195,7034,12
23,Basic Fruit Bread Recipe Recipe ,10,40,50,7035,10
24,Angel Biscuit Rolls Recipe ,10,20,30,7037,24
25,Panettone II Recipe ,5,180,185,7038,10
26,'J.P.''s Big Daddy Biscuits Recipe ',30,15,45,7040,6
27,Bread Machine Challah I Recipe ,5,180,185,7043,12
28,Oatmeal Molasses Bread Recipe ,5,180,185,7046,12
29,Zucchini Pineapple Bread I Recipe ,20,60,80,7048,24
30,Pumpkin Swirl Bread Recipe ,15,70,95,7049,10
31,Jule Kaka Recipe ,20,40,360,7050,48
32,'Steve''s Whole Wheat Recipe ',5,180,185,7051,12
33,Oatmeal Bread II Recipe ,5,180,185,7052,12
34,Coconut Pumpkin Nut Bread Recipe ,10,75,95,7053,20
35,Dizzy Pineapple Bread Recipe ,5,60,65,7054,12
36,European Black Bread Recipe ,5,180,185,7055,10
37,Chili Bread Recipe ,5,180,185,7056,10
38,Whole Wheat Honey Bread Recipe ,5,180,185,7058,12
39,Carrot Thyme Bread Recipe ,5,180,185,7059,12
40,Golly Gee Gluten,10,15,25,7060,3
41,Amish Cinnamon Bread Recipe ,10,60,70,7064,36
42,French Herb Bread Recipe ,30,30,160,7065,12
43,Easy Rice Bread Recipe ,20,60,170,7066,12
44,Lemon Poppy Seed Muffins I Recipe ,20,20,40,7067,12
45,Lemon Poppy Seed Muffins II Recipe ,13,17,30,7068,12
46,Special Banana Bread Recipe ,10,60,70,7069,24
47,Injera Recipe ,10,10,1460,7070,14
48,Pita Bread Recipe ,30,20,50,7071,8
49,Raisin Bread II Recipe ,5,180,195,7072,12
50,Hot Cross Buns II Recipe ,40,20,150,7074,6
51,Plain and Simple Sourdough Bread Recipe ,5,180,185,7075,12
52,Garlic and Herb Bread Recipe ,5,180,185,7076,12
53,'Ron''s Fruit Bread Recipe ',5,180,185,7077,12
54,'Ron''s Bread Machine White Recipe ',5,180,185,7078,15
55,Portuguese Sweet Bread I Recipe ,5,180,185,7079,12
56,Pizza Crust I Recipe ,10,20,160,7080,15
57,Tomato Basil Sherry Bread Recipe ,5,180,185,7081,12
58,"Onion, Garlic, Cheese Bread Recipe ",5,180,185,7082,12
59,Irish Soda Bread III Recipe ,5,180,185,7083,15
60,The All,5,180,185,7084,12
61,Sourdough Wheat Bread Recipe ,5,180,185,7085,12
62,Basic British Scones Recipe ,15,10,25,7086,12
63,Yeast,5,45,50,7087,12
64,Bread Bowls II Recipe ,10,20,800,7088,4
65,Bread Sticks Recipe ,15,12,57,7089,12
66,Banana Macadamia Nut Bread Recipe ,5,180,185,7090,12
67,Cinnamon Bread II Recipe ,5,180,185,7091,12
68,Homemade Wonderful Bread Recipe ,10,180,205,7092,15
69,Spudnuts Recipe ,20,20,100,7093,80
70,Irresistible Irish Soda Bread Recipe ,15,70,85,7095,12
71,Christmas Stollen II Recipe ,NULL,NULL,NULL,7098,20
72,Pizza Crust II Recipe ,NULL,NULL,NULL,7099,60
73,Pistachio Bread Recipe ,NULL,NULL,NULL,7101,24
74,Grill Dough Recipe ,NULL,NULL,NULL,7102,12
75,German Rye Bread Recipe ,NULL,NULL,NULL,7103,24
76,Spelt Bread I Recipe ,NULL,NULL,NULL,7104,24
77,Essene Bread Recipe ,NULL,NULL,NULL,7106,12
78,Apple Bran Cheddar Muffins Recipe ,15,20,35,7108,12
79,Quick and Easy Monkey Bread Recipe ,10,30,40,7110,12
80,Spiced Apple Muffins Recipe ,NULL,NULL,NULL,7112,12
81,Banana Chip Muffins II Recipe ,NULL,NULL,NULL,7113,12
82,Mocha Muffins Recipe ,10,25,35,7114,12
83,Banana Bread ,15,50,75,7116,10
84,Dark Rye Bread Recipe ,NULL,NULL,NULL,7117,12
85,Mediterranean Black Olive Bread Recipe ,NULL,NULL,NULL,7119,15
86,Italian Herb Bread II Recipe ,NULL,NULL,NULL,7120,10
87,Batter White Bread Recipe ,25,45,160,7121,12
88,Authentic Mexican Tortillas Recipe ,30,25,55,7122,12
89,Johnnycakes Recipe ,NULL,NULL,NULL,7123,10
90,'Julia''s Hot Cross Buns Recipe ',NULL,NULL,NULL,7124,15
91,High Flavor Bran Bread Recipe ,NULL,NULL,NULL,7127,15
92,Oat Bran Bread Recipe ,NULL,NULL,NULL,7129,12
93,Oatmeal Bread III Recipe ,NULL,NULL,NULL,7130,12
94,Blueberry Bread II Recipe ,NULL,NULL,NULL,7131,6
95,Pear,NULL,NULL,NULL,7133,15
96,Basic Sourdough Bread Recipe ,NULL,NULL,NULL,7134,12
97,Bread Pudding with Lemon Sauce I Recipe ,NULL,NULL,NULL,7135,15
98,Fondue Bread Recipe ,NULL,NULL,NULL,7136,20
99,Southern Butter Rolls Recipe ,NULL,NULL,NULL,7138,24
100,Banana Nut Bread II Recipe ,NULL,NULL,NULL,7141,10
101,Italian Cheese Bread Recipe ,NULL,NULL,NULL,7142,12
102,Nut Rolls Recipe ,NULL,NULL,NULL,7143,60
103,Bread Machine Spelt Bread Recipe ,NULL,NULL,NULL,7144,12
104,Sausage Bread Recipe ,NULL,NULL,NULL,7145,24
105,Cheddar Bay Biscuits Recipe ,NULL,NULL,NULL,7146,20
106,Tarradls (Italian Pepper Rings) Recipe ,NULL,NULL,NULL,7147,24
107,Sticky Buns II Recipe ,NULL,NULL,NULL,7148,12
108,French Brioche Recipe ,15,20,155,7149,15
109,Golden Cake Batter Bread Recipe ,NULL,NULL,NULL,7150,14
110,Blueberry Orange Bread Recipe ,NULL,NULL,NULL,7151,12
111,Honey and Flaxseed Bread Recipe ,NULL,NULL,NULL,7153,12
112,Whole Wheat Banana Nut Bread Recipe ,15,55,70,7155,12
113,San Francisco Sourdough Bread Recipe ,NULL,NULL,NULL,7156,24
114,Strawnana Bread Recipe ,NULL,NULL,NULL,7158,24
115,Herman Sourdough Starter Recipe ,30,NULL,10000,7160,8
116,Herman Biscuits Recipe ,15,30,120,7161,12
117,Herman Coffee Cake Recipe ,15,40,55,7162,18
118,Favorite Banana Blueberry Quick Bread Recipe ,25,50,85,7163,12
119,Welsh Bread Recipe ,NULL,NULL,NULL,7165,10
120,Cherry Vanilla Chip Muffins Recipe ,NULL,NULL,NULL,7166,6
121,Chocolate Zucchini Muffins Recipe ,NULL,NULL,NULL,7167,24
122,Herman Cinnamon Rolls Recipe ,20,25,90,7170,15
123,Herman Dinner Rolls Recipe ,15,20,75,7171,16
124,Six Week Bran Muffins Recipe ,NULL,NULL,NULL,7172,216
125,'Schlotsky''s Bread Recipe ',NULL,NULL,NULL,7173,12
126,Navajo Fry Bread I Recipe ,NULL,NULL,NULL,7174,8
127,Banana Chai Bread Recipe ,NULL,NULL,NULL,7175,12
128,"Soft, Moist and Gooey Cinnamon Buns Recipe ",15,20,215,7176,24
129,Bread Pudding II Recipe ,30,45,75,7177,12
130,Bread Machine Bagels Recipe ,30,205,235,7178,9
131,Beignets Recipe ,30,30,180,7179,10
132,Sourdough Pancakes Recipe ,NULL,NULL,NULL,7180,4
133,Old,NULL,NULL,NULL,7182,12
134,Norwegian Flat Bread Recipe ,NULL,NULL,NULL,7183,12
135,Easy Biscuit Mixture Recipe ,NULL,NULL,NULL,7184,24
136,Gluten,NULL,NULL,NULL,7185,12
137,Coconut Muffins Recipe ,NULL,NULL,NULL,7187,12
138,Zucchini Pineapple Bread II Recipe ,30,60,90,7188,24
139,Pizza Crust for Bread Machine Recipe ,NULL,NULL,NULL,7189,12
140,Spinach Bread Recipe ,NULL,NULL,NULL,7190,15
141,'Jo Jo''s Favorite Banana Muffins Recipe ',NULL,NULL,NULL,7191,18
142,Real Southern Cornbread Recipe ,10,50,60,7192,12
143,Herb Biscuits Recipe ,10,12,22,7193,8
144,Zucchini Bread V Recipe ,NULL,NULL,NULL,7195,24
145,Broccoli and Four Cheese Calzones Recipe ,40,30,180,7197,6
146,"Broccoli, Pepperoni and Three Cheese Calzones Recipe ",NULL,NULL,NULL,7198,6
147,Prosciutto Filling for Calzones Recipe ,NULL,NULL,NULL,7199,6
148,Banana Nut and Ginger Bread Recipe ,25,60,85,7200,24
149,Lemon Poppy Seed Amish Friendship Bread Recipe ,NULL,NULL,NULL,7201,24
150,Crunchy Honey Wheat Bread Recipe ,NULL,NULL,NULL,7203,12
151,Paximade Recipe ,NULL,NULL,NULL,7204,12
152,Southern Biscuits with Mayonnaise Recipe ,15,20,45,7206,12
153,'Nana''s Fastnachts Recipe ',NULL,NULL,NULL,7208,60
154,Kalamata Olive and Garlic Bread Recipe ,30,30,120,7209,12
155,Broccoli Cornbread Recipe ,10,30,40,7210,15
156,Deluxe Waffles Recipe ,NULL,NULL,NULL,7212,6
157,Pear Bread I Recipe ,NULL,NULL,NULL,7214,20
158,Pumpkin Yeast Bread Recipe ,NULL,NULL,NULL,7215,12
159,Sweet Corn Cake Recipe ,15,60,75,7216,6
160,Pepperoni Pizza Bread Recipe ,NULL,NULL,NULL,7217,12
161,Rye Starter Recipe ,NULL,NULL,NULL,7218,4
162,Muesli,NULL,NULL,NULL,7220,12
163,Orange Spice Muffins Recipe ,10,20,30,7221,6
164,Double Quick Dinner Rolls Recipe ,NULL,NULL,NULL,7222,12
165,Banana Chocolate Chip Muffins Recipe ,NULL,NULL,NULL,7223,12
166,Pan de Muertos (Mexican Bread of the Dead) Recipe ,NULL,NULL,NULL,7224,12
167,Cracked Wheat Sourdough Bread Recipe ,NULL,NULL,NULL,7225,24
168,Sourdough Buckwheat Pancakes Recipe ,20,20,40,7226,4
169,Chocolate Chip Sourdough Muffins Recipe ,NULL,NULL,NULL,7227,12
170,Delightful Apple Spice Muffins Recipe ,NULL,NULL,NULL,7228,16
171,Pumpkin Chip Bread Recipe ,NULL,NULL,NULL,7230,24
172,'Granny''s Corn Flour Tortillas Recipe ',NULL,NULL,NULL,7231,12
173,Corn Yeast Rolls Recipe ,NULL,NULL,NULL,7233,8
174,'Grandma Emma''s Spice Loaf Recipe ',NULL,NULL,NULL,7234,12
175,Portuguese Sweet Bread II Recipe ,NULL,NULL,NULL,7235,15
176,Challah in a Hurry Recipe ,NULL,NULL,NULL,7236,30
177,Jam Muffins Recipe ,NULL,NULL,NULL,7237,12
178,Pseudo Sourdough for the Bread Machine Recipe ,NULL,NULL,NULL,7240,12
179,Pumpkin Pie Bread Recipe ,15,60,75,7243,24
180,'Aunt Bert''s White Cake Recipe ',NULL,NULL,NULL,7246,18
181,Easy Plain Cake Recipe ,NULL,NULL,NULL,7247,18
182,Peanut Butter Cake I Recipe ,30,40,70,7248,24
183,Sourdough Chocolate Cranberry Cake Recipe ,NULL,NULL,NULL,7249,24
184,'Donna''s Pound Cake Recipe ',30,45,135,7250,14
185,Chocolate Zucchini Cake I Recipe ,NULL,NULL,NULL,7251,18
186,Carrot Cake II Recipe ,20,40,60,7254,18
187,Dirt Cake I Recipe ,NULL,NULL,NULL,7255,10
188,Chocolate Chip Oatmeal Cake Recipe ,NULL,NULL,NULL,7256,24
189,'Pol''s Apple Cake Recipe ',30,70,120,7257,12
190,"'Grandma''s Eggless, Butterless, Milkless Cake Recipe '",NULL,NULL,NULL,7259,18
191,Italian Cream Cake I Recipe ,NULL,NULL,NULL,7260,12
192,Texas Sheet Cake I Recipe ,30,30,60,7261,20
193,Streusel Coffee Cake Recipe ,NULL,NULL,NULL,7262,12
194,Boiled Raisin Cake I Recipe ,30,60,90,7263,12
195,Waldorf Astoria Red Cake Recipe ,NULL,NULL,NULL,7264,20
196,Krazy Kake Recipe ,NULL,NULL,NULL,7265,18
197,Cocoa Apple Cake Recipe ,NULL,NULL,NULL,7266,12
198,Best Cheesecake on Earth Recipe ,30,150,190,7267,12
199,'Grandma Snyder''s Oatmeal Cake Recipe ',NULL,NULL,NULL,7268,18
200,Fabulous Fudge Chocolate Cake Recipe ,NULL,NULL,NULL,7269,24
201,No Bake Cheesecake I Recipe ,30,NULL,120,7270,8
202,Pumpkin Pie Cake I Recipe ,NULL,NULL,NULL,7271,24
203,Awesome Carrot Cake with Cream Cheese Frosting Recipe ,30,40,100,7272,24
204,Chantilly Cake Frosting Recipe ,NULL,NULL,NULL,7273,24
205,Plum Bread Recipe ,20,50,80,7274,16
206,'Mom''s Carrot Cake Recipe ',NULL,NULL,NULL,7275,18
207,Easy Lemon Cake Recipe ,NULL,NULL,NULL,7276,24
208,French Buttercream Frosting Recipe ,NULL,NULL,NULL,7277,12
209,Brownie Torte Recipe ,NULL,NULL,NULL,7278,12
210,The Easiest Chocolate Cake Recipe ,NULL,NULL,NULL,7280,18
211,Chocolate Cherry Cake I Recipe ,NULL,NULL,NULL,7281,18
212,Pecan Pound Cake Recipe ,NULL,NULL,NULL,7282,14
213,Easy Streusel Coffee Cake Recipe ,NULL,NULL,NULL,7283,12
214,Microwave Cake Recipe ,NULL,NULL,NULL,7285,12
215,Creme de Menthe Cake I Recipe ,NULL,NULL,NULL,7286,14
216,Lick Your Lips Cake Recipe ,NULL,NULL,NULL,7287,18
217,Dump Cake I Recipe ,10,40,50,7288,24
218,'Miss Beth''s Yoghurt Cake Recipe ',NULL,NULL,NULL,7290,18
219,Angelo Cake Recipe ,30,90,120,7291,12
220,Cherry Nut Cake I Recipe ,5,45,50,7292,24
221,Quick Fudge Icing Recipe ,NULL,NULL,NULL,7293,8
222,Chocolate Cherry Upside Down Cake Recipe ,NULL,NULL,NULL,7294,24
223,Chocolate Pound Cake I Recipe ,NULL,NULL,NULL,7295,14
224,Quick Black Forest Cake Recipe ,NULL,NULL,NULL,7296,18
225,Carrot Cake I Recipe ,NULL,NULL,NULL,7297,12
226,Pineapple Cake I Recipe ,NULL,NULL,NULL,7299,18
227,Botercake (Butter Cake) Recipe ,NULL,NULL,NULL,7300,15
228,Marron Layer Cake Recipe ,NULL,NULL,NULL,7301,24
229,Butter Pound Cake Recipe ,30,90,120,7303,14
230,Eclair Cake Recipe ,25,NULL,265,7304,14
231,Banana Cake I Recipe ,NULL,NULL,NULL,7305,12
232,Surprise Banana Cake Recipe ,30,30,60,7306,24
233,Mini Cheesecakes I Recipe ,30,15,45,7307,48
234,Apricot Sponge Cake Recipe ,NULL,NULL,NULL,7308,14
235,Praline Chocolate Cake Recipe ,NULL,NULL,NULL,7309,14
236,Burnt Sugar Cake I Recipe ,NULL,NULL,NULL,7310,36
237,'Mom''s Fruitcake Recipe ',30,120,240,7311,30
238,Chocolate Cake I Recipe ,NULL,NULL,NULL,7312,24
239,Brown Sugar Cake Recipe ,NULL,NULL,NULL,7313,12
240,Favorite Chocolate Cake Recipe ,20,40,60,7314,12
241,Orange Sponge Cake Recipe ,NULL,NULL,NULL,7315,12
242,Philadelphia Red Cake Recipe ,NULL,NULL,NULL,7316,10
243,Great Chocolate Cake Recipe ,NULL,NULL,NULL,7317,12
244,Double Chocolate Cake I Recipe ,NULL,NULL,NULL,7319,24
245,Coconut Pound Cake Recipe ,20,61,85,7320,14
246,Favorite Old Fashioned Gingerbread Recipe ,25,60,105,7322,9
247,Glorious Sponge Cake Recipe ,NULL,NULL,NULL,7323,14
248,Sour Cream Chocolate Cake Recipe ,NULL,NULL,NULL,7325,18
249,Cream Cheese Pound Cake I Recipe ,NULL,NULL,NULL,7326,14
250,Earthquake Cake I Recipe ,NULL,NULL,NULL,7327,24
251,Worm Cake Recipe ,NULL,NULL,NULL,7328,24
252,'Karen A''s Chocolate Dump Cake Recipe ',NULL,NULL,NULL,7329,24
253,Buttercream Cake Frosting Recipe ,NULL,NULL,NULL,7331,15
254,Green Cake Recipe ,10,30,40,7332,24
255,Strawberry Cake I Recipe ,NULL,NULL,NULL,7333,24
256,Ricotta Cheese Cake Recipe ,20,50,70,7334,24
257,Fruit Cocktail Cake I Recipe ,30,40,90,7335,12
258,Pistachio Cake I Recipe ,30,60,90,7336,14
259,Passover Brownie Cake Recipe ,NULL,NULL,NULL,7337,18
260,Pineapple Pudding Cake Recipe ,30,30,90,7338,12
261,Banana Nut Coconut Cake Recipe ,25,50,165,7340,12
262,Cinnamon Teacake Recipe ,NULL,NULL,NULL,7341,8
263,Easy Raisin Cake Recipe ,NULL,NULL,NULL,7342,24
264,Banana Nut Frosting Recipe ,20,NULL,20,7344,12
265,Gingerbread I Recipe ,NULL,NULL,NULL,7345,12
266,Coconut Cake I Recipe ,30,30,4380,7346,12
267,Fresh Pineapple Upside Down Cake Recipe ,30,30,70,7347,12
268,Creamy White Layers Recipe ,NULL,NULL,NULL,7348,24
269,'Devil''s Food Cake I Recipe ',NULL,NULL,NULL,7349,24
270,Chocolate Fudge Buttercream Frosting Recipe ,NULL,NULL,NULL,7350,16
271,'Auntie''s Buttermilk Cake Recipe ',NULL,NULL,NULL,7351,14
272,Our Favorite Chocolate Cake Recipe ,NULL,NULL,NULL,7352,14
273,Norwegian Hazelnut Cake Recipe ,NULL,NULL,NULL,7354,16
274,Cranberry Swirl Coffeecake Recipe ,NULL,NULL,NULL,7355,14
275,Fabulous Oatmeal,NULL,NULL,NULL,7359,24
276,Cream Cheese Frosting I Recipe ,NULL,NULL,NULL,7361,8
277,Chocolate Spice Cake Recipe ,NULL,NULL,NULL,7362,10
278,Old,30,30,60,7363,12
279,Easy Rum Cake Recipe ,NULL,NULL,NULL,7364,12
280,'Aunt Maria''s Pudding Cake Recipe ',NULL,NULL,NULL,7366,12
281,Lemonade Cake I Recipe ,30,30,300,7367,12
282,Lemon Pound Cake I Recipe ,NULL,NULL,NULL,7368,12
283,Rum Cake I Recipe ,NULL,NULL,NULL,7369,12
284,Crumb Cake I Recipe ,20,50,70,7370,24
285,Lemonade Frosting Recipe ,NULL,NULL,NULL,7371,16
286,'Grandma''s Fudge Cake Recipe ',NULL,NULL,NULL,7372,12
287,'Donna''s Sherry Wine Cake Recipe ',NULL,NULL,NULL,7373,12
288,Fudge Cake Recipe ,NULL,NULL,NULL,7374,18
289,Black Russian Cake I Recipe ,20,40,60,7375,12
290,Pound Cake I Recipe ,30,60,90,7376,12
291,Prune Mocha Cake Recipe ,NULL,NULL,NULL,7377,12
292,Sunshine Cake Recipe ,NULL,NULL,NULL,7378,14
293,Treasure Chest Cake Recipe ,NULL,NULL,NULL,7379,12
294,Maraschino Cherry Pound Cake Recipe ,NULL,NULL,NULL,7381,14
295,Ice Box Cake I Recipe ,20,10,510,7382,18
296,'Holly''s Black Forest Cake Recipe ',NULL,NULL,NULL,7383,12
297,Chocolate Cappuccino Cheesecake Recipe ,30,60,240,7384,12
298,Pineapple Sponge Cake Recipe ,NULL,NULL,NULL,7387,14
299,Egg,NULL,NULL,NULL,7388,14
300,Chocolate Chip Cake Recipe ,NULL,NULL,NULL,7389,12
301,Butterscotch Filling Recipe ,10,20,30,7390,12
302,Crazy Chocolate Cake Recipe ,NULL,NULL,NULL,7394,18
303,Carrot Cake III Recipe ,30,60,120,7402,18
304,Pumpkin Sheet Cake Recipe ,30,30,120,7404,20
305,'Tres Leches ''Three Milks'' Recipe ',NULL,NULL,NULL,7405,10
306,Cinnamon Coffee Cake I Recipe ,NULL,NULL,NULL,7407,14
307,Marble Crumb Cake Recipe ,NULL,NULL,NULL,7408,24
308,Strawberry Torte Recipe ,NULL,NULL,NULL,7409,12
309,Wedding Cake Frosting Recipe ,NULL,NULL,NULL,7410,20
310,Peach Cake I Recipe ,20,50,70,7411,10
311,Pineapple Upside,NULL,NULL,NULL,7412,24
312,Turtles® Cake I Recipe ,NULL,NULL,NULL,7413,24
313,Kitty Litter Cake Recipe ,NULL,NULL,NULL,7415,20
314,Chocolate Mayo Cake Recipe ,NULL,NULL,NULL,7416,24
315,Dump Cake II Recipe ,NULL,NULL,NULL,7417,24
316,Turtles® Cake II Recipe ,NULL,NULL,NULL,7418,24
317,Sugar Free Cake Recipe ,NULL,NULL,NULL,7419,12
318,Dump Cake III Recipe ,NULL,NULL,NULL,7420,24
319,Better Than Sex Cake I Recipe ,NULL,NULL,NULL,7421,24
320,Mayonnaise Cake  I Recipe ,NULL,NULL,NULL,7423,24
321,Lemon Poppy Seed Loaf Recipe ,NULL,NULL,NULL,7424,24
322,Red Velvet Cake I Recipe ,15,35,55,7425,12
323,Pina Colada Cake I Recipe ,NULL,NULL,NULL,7426,14
324,Pina Colada Cake II Recipe ,NULL,NULL,NULL,7427,18
325,Caramel Pound Cake Recipe ,30,90,120,7429,14
326,'Donna''s Famous Cheesecake Recipe ',NULL,NULL,NULL,7435,24
327,Dried Cherry Cake Recipe ,NULL,NULL,NULL,7436,12
328,Chocolate Peanut Butter Wacky Cake Recipe ,NULL,NULL,NULL,7438,18
329,Swiss Chocolate Cake Recipe ,NULL,NULL,NULL,7439,12
330,Key Lime Cheesecake I Recipe ,NULL,NULL,NULL,7441,12
331,Mayonnaise Cake  II Recipe ,NULL,NULL,NULL,7442,12
332,'Rick''s Special Buttercream Frosting Recipe ',30,NULL,30,7443,12
333,Sour Cream Coffee Cake I Recipe ,NULL,NULL,NULL,7445,12
334,Peach Upside Down Cake II Recipe ,NULL,NULL,NULL,7447,10
335,Chocolate Sauerkraut Cake I Recipe ,NULL,NULL,NULL,7448,12
336,Fluffy Creamy Frosting Recipe ,NULL,NULL,NULL,7449,12
337,Texas Tornado Cake Recipe ,NULL,NULL,NULL,7450,18
338,Caramel Nougat Cake Recipe ,30,60,90,7451,12
339,Caramel Nougat Cake II Recipe ,NULL,NULL,NULL,7452,20
340,Chocolate Caramel Nut Cake Recipe ,NULL,NULL,NULL,7453,24
341,Caramel Nougat Cake III Recipe ,NULL,NULL,NULL,7454,12
342,Chocolate Caramel Nut Cake II Recipe ,NULL,NULL,NULL,7455,24
343,'Peter''s Cheesecake Recipe ',NULL,NULL,NULL,7456,12
344,Sauerkraut Cake Recipe ,NULL,NULL,NULL,7457,24
345,Gooey Butter Cake I Recipe ,15,45,60,7459,24
346,'Mary Oppenhiemer''s Butter Cake Recipe ',NULL,NULL,NULL,7461,12
347,Flourless Chocolate Roll Recipe ,NULL,NULL,NULL,7462,8
348,Dump Cake IV Recipe ,NULL,NULL,NULL,7465,12
349,Deep Chocolate Raspberry Cake Recipe ,40,45,145,7466,12
350,Lady Baltimore Cake Recipe ,30,60,90,7471,12
351,Orange Chiffon Cake Recipe ,NULL,NULL,NULL,7473,14
352,Crazy Cake Recipe ,NULL,NULL,NULL,7475,18
353,'Grandma''s Chocolate Marvel Cake Recipe ',30,60,90,7476,24
354,Party Frosting Recipe ,NULL,NULL,NULL,7477,16
355,Cinnamon Swirl Bundt Coffee Cake Recipe ,30,50,80,7478,12
356,Kentucky Butter Cake Recipe ,30,60,120,7479,12
357,Chocolate Rum Cake Recipe ,25,60,85,7480,12
358,Tunnel of Fudge Cake III Recipe ,NULL,NULL,NULL,7484,12
359,Decorator Frosting I Recipe ,NULL,NULL,NULL,7486,12
360,Honey Cake I Recipe ,NULL,NULL,NULL,7487,24
361,White Cake Frosting I Recipe ,NULL,NULL,NULL,7488,15
362,Harvey Wallbanger Cake Recipe ,NULL,NULL,NULL,7489,12
363,Gooey Butter Cake II Recipe ,NULL,NULL,NULL,7492,24
364,Buttermilk Pound Cake I Recipe ,NULL,NULL,NULL,7493,14
365,Zucchini Cake I Recipe ,25,25,140,7494,12
366,Peanut Butter Cake II Recipe ,30,30,60,7495,12
367,Peanut Butter Frosting Recipe ,15,NULL,15,7496,16
368,Sachertorte Recipe ,NULL,NULL,NULL,7497,12
369,Chocolate Chip Date Nut Cake Recipe ,30,45,90,7498,24
370,Zucchini Cake II Recipe ,30,45,75,7499,24
371,Spanish Bar Cake Recipe ,NULL,NULL,NULL,7500,24
372,Coco,NULL,NULL,NULL,7501,14
373,Coco,NULL,NULL,NULL,7502,18
374,Sock it to Me Cake I Recipe ,NULL,NULL,NULL,7503,12
375,Sock it to Me Cake II Recipe ,NULL,NULL,NULL,7504,18
376,Caramel Frosting I Recipe ,10,5,15,7506,12
377,Jamaica Cake Recipe ,NULL,NULL,NULL,7509,14
378,Butter Brickle Cake Recipe ,NULL,NULL,NULL,7511,14
379,Graham Cracker Cake II Recipe ,30,30,60,7512,12
380,Pistachio Nut Cake I Recipe ,NULL,NULL,NULL,7513,12
381,Best Chocolate Cake Recipe ,NULL,NULL,NULL,7516,18
382,Cherry Nut Cake II Recipe ,NULL,NULL,NULL,7517,14
383,Carrot and Walnut Cake Recipe ,NULL,NULL,NULL,7518,14
384,Daffodil Cake Recipe ,15,50,65,7519,12
385,Poppy Seed Cake I Recipe ,NULL,NULL,NULL,7520,20
386,Almond Custard Filling Recipe ,NULL,NULL,NULL,7521,12
387,Rum Cake II Recipe ,NULL,NULL,NULL,7522,14
388,Seven,NULL,NULL,NULL,7524,12
389,Mocha Cake II Recipe ,NULL,NULL,NULL,7526,12
390,Easy Dump Cake Recipe ,25,55,80,7527,12
391,Blueberry Dump Cake Recipe ,NULL,NULL,NULL,7528,18
392,Mississippi Mud Cake I Recipe ,NULL,NULL,NULL,7530,24
393,Mississippi Mud Cake II Recipe ,NULL,NULL,NULL,7531,24
394,New York Cheesecake I Recipe ,30,40,90,7532,12
395,New York Cheesecake II Recipe ,30,50,240,7533,16
396,Orange Cream Cake I Recipe ,30,60,270,7534,18
397,Chocolate Chip,NULL,NULL,NULL,7535,12
398,'Kelly''s Apple Cocoa Cake Recipe ',NULL,NULL,NULL,7536,12
399,Butternut Spice Cake Recipe ,NULL,NULL,NULL,7537,14
400,Heavenly Cake Recipe ,NULL,NULL,NULL,7539,24
401,Mini Cinnamon Cakes Recipe ,NULL,NULL,NULL,7541,6
402,Special Buttercream Frosting Recipe ,30,NULL,30,7542,36
403,Apple Chiffon Cake Recipe ,NULL,NULL,NULL,7543,14
404,Barbadian Plain Cake Recipe ,NULL,NULL,NULL,7544,12
405,Orange Nut Raisin Cake Recipe ,NULL,NULL,NULL,7545,12
406,Honey Bun Cake I Recipe ,30,60,105,7547,24
407,Dr Pepper® Cake Recipe ,NULL,NULL,NULL,7548,24
408,Amaretto Cheesecake I Recipe ,30,60,90,7549,12
409,Pineapple Cake II Recipe ,20,30,90,7550,24
410,Buttery Milk Syrup Recipe ,NULL,NULL,NULL,7551,12
411,Paris,120,37,157,7552,15
412,Banana Butter Icing Recipe ,NULL,NULL,NULL,7554,11
413,Creamy Frosting Recipe ,NULL,NULL,NULL,7555,15
414,Lemon Cream Cheese Frosting Recipe ,NULL,NULL,NULL,7556,15
415,Seven Minute Frosting I Recipe ,NULL,NULL,NULL,7557,12
416,Marshmallow Icing Recipe ,NULL,NULL,NULL,7558,12
417,Seafoam Icing Recipe ,NULL,NULL,NULL,7559,12
418,Poppy Seed Chiffon Recipe ,NULL,NULL,NULL,7560,14
419,Caramel Frosting III Recipe ,NULL,NULL,NULL,7561,20
420,Cone Cupcakes Recipe ,NULL,NULL,NULL,7562,24
421,Too Much Chocolate Cake Recipe ,NULL,NULL,NULL,7565,12
422,Orange Sunshine Cake Recipe ,NULL,NULL,NULL,7566,36
423,Rainbow Cake Recipe ,NULL,NULL,NULL,7567,36
424,Popcorn Cake I Recipe ,30,5,35,7568,14
425,Hummingbird Cake I Recipe ,NULL,NULL,NULL,7569,14
426,Battenburg Cake Recipe ,30,30,90,7570,12
427,Bridal Shower Cake Recipe ,30,25,115,7572,8
428,Pie Cake Recipe ,NULL,NULL,NULL,7576,18
429,Mocha Icing Recipe ,NULL,NULL,NULL,7578,12
430,Apricot Filling and Frosting for Angel Food Cakes Recipe ,20,10,90,7579,12
431,Snowy Boiled Icing Recipe ,NULL,NULL,NULL,7580,15
432,Tomato Soup Cake I Recipe ,NULL,NULL,NULL,7583,16
433,Amaretto Cheesecake II Recipe ,30,60,240,7586,12
434,Irish Cream Cheesecake Recipe ,NULL,NULL,NULL,7587,12
435,Genoise Recipe ,NULL,NULL,NULL,7590,10
436,'Aunt Johnnie''s Pound Cake Recipe ',30,90,120,7591,12
437,Sour Cream Coffee Cake II Recipe ,NULL,NULL,NULL,7592,12
438,Yellow Pound Cake Recipe ,NULL,NULL,NULL,7593,14
439,'Absolutely Delicious ''Scratch'' Cake! Recipe ',15,60,75,7595,18
440,Cream Cheese Pound Cake II Recipe ,30,60,90,7597,12
441,Peanut Butter and Chocolate Candy Cake Recipe ,NULL,NULL,NULL,7598,25
442,Mint Buttercream Frosting With Dark Chocolate Glaze Recipe ,NULL,NULL,NULL,7600,12
443,Chocolate Mint Mayonnaise Cake Recipe ,NULL,NULL,NULL,7601,24
444,Sad Cake Recipe ,NULL,NULL,NULL,7602,24
445,Raspberry and Strawberry Buckle Recipe ,NULL,NULL,NULL,7603,15
446,Hot Fudge Pudding Cake I Recipe ,NULL,NULL,NULL,7604,10
447,No Bake Fruitcake Recipe ,NULL,NULL,NULL,7605,18
448,Caramel Nougat Cake IV Recipe ,NULL,NULL,NULL,7606,14
449,Chocolate Marshmallow Icing Recipe ,NULL,NULL,NULL,7607,12
450,Peanut Candy Bar Cake Recipe ,NULL,NULL,NULL,7608,24
451,Blackberry Wine Cake I Recipe ,NULL,NULL,NULL,7609,14
452,Banana Nut Cake Recipe ,30,30,60,7610,12
453,Honey Bun Cake II Recipe ,NULL,NULL,NULL,7611,24
454,'Chocolate Lovers'' Favorite Cake Recipe ',30,60,120,7612,12
455,Lane Cake Recipe ,NULL,NULL,NULL,7613,10
456,Lane Cake Filling Recipe ,10,20,30,7614,12
457,Apple Cake I Recipe ,NULL,NULL,NULL,7615,24
458,Chocolate Chocolate Chip Dream Cake Recipe ,NULL,NULL,NULL,7616,14
459,Very Special Tomato Spice Cake Recipe ,NULL,NULL,NULL,7618,12
460,Dutch Apple Cake Recipe ,NULL,NULL,NULL,7619,15
461,Cornstarch Cake Recipe ,NULL,NULL,NULL,7621,12
462,White Mountain Cake Recipe ,35,25,60,7623,12
463,White Mountain Frosting Recipe ,NULL,NULL,NULL,7624,20
464,Maple Walnut Frosting Recipe ,20,NULL,20,7626,12
465,Almond Paste Recipe ,20,NULL,20,7627,12
466,White Cream Cake Recipe ,NULL,NULL,NULL,7630,24
467,Granny Cake I Recipe ,30,25,55,7632,24
468,Banana Angel Food Cake Recipe ,30,60,90,7634,12
469,Screw Pine Cake Recipe ,NULL,NULL,NULL,7635,24
470,Halloween Layer Cake Recipe ,30,30,60,7636,24
471,Philly Cheesecake Recipe ,30,60,90,7639,10
472,Gob Cake Recipe ,NULL,NULL,NULL,7640,24
473,One ,NULL,NULL,NULL,7642,24
474,German Christmas Gingerbread Recipe ,NULL,NULL,NULL,7643,14
475,Double Chocolate Cake II Recipe ,NULL,NULL,NULL,7647,16
476,Chocolate Buttercream Recipe ,NULL,NULL,NULL,7649,20
477,'Poor Man''s Cake I Recipe ',30,60,90,7651,18
478,Chocaroon Cake Recipe ,NULL,NULL,NULL,7652,12
479,Orange Pecan Cake Recipe ,NULL,NULL,NULL,7653,14
480,Almond Lemon Cake Recipe ,40,70,110,7654,14
481,Citrus Carrot Cake Recipe ,NULL,NULL,NULL,7655,18
482,Old Hermit Cake Recipe ,NULL,NULL,NULL,7656,14
483,Praline Cheesecake Recipe ,NULL,NULL,NULL,7668,12
484,Apricot Nectar Cake I Recipe ,NULL,NULL,NULL,7669,14
485,Sourdough Chocolate Cake Recipe ,NULL,NULL,NULL,7671,18
